ID,Author,Text,Date,Like_Count,Retweet_Count,Reply_Count,URL
1863835279225675994,NumanKurtulmus,"Pençe Kilit Operasyonu bölgesinde şehid olan kahraman Mehmetçiğimiz Uzman Çavuş Eren Kızıldağ’a Allah’tan rahmet, kederli ailesine ve yakınlarına sabır diliyorum. Aziz milletimizin başı sağ olsun. 🇹🇷",Tue Dec 03 06:38:53 +0000 2024,179,28,18,https://twitter.com/NumanKurtulmus/status/1863835279225675994
1862531573523914793,NumanKurtulmus,"❝Türkiye’nin bölge politikalarıyla ilgili millî menfaati, daha fazla birleşme, bütünleşme, iş birliği ve entegrasyondan geçmektedir.❞ https://t.co/lOVWXOqY62",Fri Nov 29 16:18:25 +0000 2024,287,59,137,https://twitter.com/NumanKurtulmus/status/1862531573523914793
1862531478027903479,NumanKurtulmus,"RT @TBMMresmi: Türkiye Büyük Millet Meclisi Başkanımız @NumanKurtulmus'un katıldığı NTV ""Özel Röportaj"" canlı yayınından öne çıkan başlıkla…",Fri Nov 29 16:18:03 +0000 2024,0,25,0,https://twitter.com/NumanKurtulmus/status/1862531478027903479
1862493386239852856,NumanKurtulmus,"RT @TBMMresmi: Türkiye Büyük Millet Meclisi Başkanımız @NumanKurtulmus, Filistin'in Ankara Büyükelçiliği tarafından 29 Kasım Filistin Halkı…",Fri Nov 29 13:46:41 +0000 2024,0,37,0,https://twitter.com/NumanKurtulmus/status/1862493386239852856
1862408266011353289,NumanKurtulmus,"#CANLIYAYIN  NTV'de ""Özel Röportaj"" yayınında gündemi değerlendiriyoruz https://t.co/4MU1dVi8CM",Fri Nov 29 08:08:27 +0000 2024,328,58,146,https://twitter.com/NumanKurtulmus/status/1862408266011353289
1862375991911297090,NumanKurtulmus,"NTV'de ""Özel Röportaj"" yayınında gündemi değerlendireceğiz.

🗓 29 Kasım 2024 Cuma
📺 NTV
🕚 11:00 https://t.co/TZU5AIV79I",Fri Nov 29 06:00:12 +0000 2024,124,17,34,https://twitter.com/NumanKurtulmus/status/1862375991911297090
1862219732960567578,NumanKurtulmus,❝Dokunulmaz zannedilen İsrail’e dokunulmuştur.❞ https://t.co/2kkKkXs34L,Thu Nov 28 19:39:17 +0000 2024,304,49,56,https://twitter.com/NumanKurtulmus/status/1862219732960567578
1862207586289778722,NumanKurtulmus,"20 . MÜSİAD EXPO 2024 Uluslararası Ticaret Fuarı’nda, iş dünyasının temsilcileriyle bir araya geldik.

MÜSİAD, kuruluşundan itibaren her yıl sürekli çıtasını yükselterek bugünlere gelmiş, örnek bir STK olarak Türkiye’nin yakın dönemine damgasını vurmuştur. Bu yıl 20’ncisi düzenlenen EXPO Uluslararası Ticaret Fuarı ise bu başarının görünen yüzlerinden biridir.

MÜSİAD’ın geldiği bu noktada emeği bulunan tüm kardeşlerime, yönetici ve temsilcilerine teşekkür ediyor, çalışmalarında üstün başarılar diliyorum.",Thu Nov 28 18:51:01 +0000 2024,324,59,64,https://twitter.com/NumanKurtulmus/status/1862207586289778722
1862176937994785029,NumanKurtulmus,#CANLIYAYIN  20. MÜSİAD EXPO 2024 Uluslararası Ticaret Fuarı https://t.co/F7cdb3eL4b,Thu Nov 28 16:49:14 +0000 2024,298,43,32,https://twitter.com/NumanKurtulmus/status/1862176937994785029
1861810481146536330,NumanKurtulmus,"Cumhurbaşkanımız Sayın Recep Tayyip Erdoğan'ın teşrifleriyle gerçekleştirilen, Kültür ve Turizm Bakanlığı Özel Ödülleri ve Yaşayan İnsan Hazineleri Ödül Töreni'ne iştirak ettik.

Ödüllerini tevdi ettiğimiz sanatkârlarımızı ve kurumlarımızı tebrik ediyor; icra ettikleri sanat faaliyetleriyle köklü millî kültür mirasımızı yaşatmaları, zenginleştirmeleri ve nesilden nesile taşımaları dolayısıyla teşekkür ediyorum.",Wed Nov 27 16:33:04 +0000 2024,354,45,85,https://twitter.com/NumanKurtulmus/status/1861810481146536330
1861788621147189318,NumanKurtulmus,RT @RTErdogan: Kültür ve Turizm Bakanlığı Özel Ödülleri ve Yaşayan İnsan Hazineleri Ödül Töreni https://t.co/fseDegy4dI,Wed Nov 27 15:06:12 +0000 2024,0,2338,0,https://twitter.com/NumanKurtulmus/status/1861788621147189318
1861734013158744329,NumanKurtulmus,"Veda ziyareti dolayısıyla Ankara’da bulunan KKTC Cumhuriyet Meclisi önceki dönem Başkanı Zorlu Töre ile bir araya geldik. 

Meclis başkanlığı süresince parlamentolarımız arasındaki ilişkilere katkısı ve Kıbrıs davasındaki öncü rolü dolayısıyla kendisine bir kez daha yürekten teşekkür ediyorum. 

Kıbrıs Türk halkının hukuku, refahı ve mutluluğu için Türkiye olarak çalışmalarımızı ve mücadelemizi en güçlü şekilde sürdürmeye devam edeceğiz.",Wed Nov 27 11:29:12 +0000 2024,364,43,72,https://twitter.com/NumanKurtulmus/status/1861734013158744329
1861464585976402259,NumanKurtulmus,"❝Şartlar ne olursa olsun; Filistin özgürleşene kadar, nehirden denize özgür Filistin kurulana kadar bu mücadeleyi vermeye devam edeceğiz.❞ https://t.co/iKMxMT10Dd",Tue Nov 26 17:38:36 +0000 2024,420,73,138,https://twitter.com/NumanKurtulmus/status/1861464585976402259
1861399766019514827,NumanKurtulmus,"Türkiye İnsan Hakları ve Eşitlik Kurumu (TİHEK) tarafından hazırlanan, ""Filistin’de İnsan Hakları İhlalleri ve Gazze Soykırımı"" raporu tanıtım toplantımızı Gazi Meclisimizde gerçekleştirdik. 

Türkiye olarak ilk andan itibaren yekvücut hâlinde Filistinli kardeşlerimizin yanında, ""insanlık cephesinin"" en ön safında yer aldık, yer almaya da devam edeceğiz. 

TİHEK'in bu değerli raporu aslında tarafını belli etmenin sembollerinden birisidir. Tarihe kayıt düşmesi açısından böylesine değerli bir çalışmayı hayata geçiren herkese teşekkür ediyor, Filistin’de şehadet mertebesine ulaşan kardeşlerimizi rahmetle anıyor, faillerini bir kez daha nefretle kınıyorum.

Şartlar ne olursa olsun; Filistin özgürleşene kadar, nehirden denize özgür Filistin kurulana kadar bu mücadeleyi vermeye devam edeceğiz. 🇹🇷🇵🇸",Tue Nov 26 13:21:02 +0000 2024,296,46,55,https://twitter.com/NumanKurtulmus/status/1861399766019514827
1861369652234068330,NumanKurtulmus,"#CANLIYAYIN  ""Filistin’de İnsan Hakları İhlalleri ve Gazze Soykırımı"" Raporu Tanıtım Programı https://t.co/IWyzaCdLT8",Tue Nov 26 11:21:22 +0000 2024,313,75,48,https://twitter.com/NumanKurtulmus/status/1861369652234068330
1861005313870086226,NumanKurtulmus,"Kadına yönelik şiddet, bireysel bir suç olduğu kadar, toplumsal vicdanımızı derinden yaralayan, insanlık onuruna aykırı bir hak ihlalidir.

Kadına yönelik şiddeti önlemek ahlaki ve insani bir bilincin gereğidir, aynı zamanda kurumların ve toplumun her bir ferdinin ortak mücadelesini gerektirir. Bu mücadele, toplumsal adaletin sağlanması için vazgeçilmezdir. 

Şiddetin kökünü kazımak, kadınları hayatın her alanında güçlendirmek için kararlı adımlar atmak zorundayız. 

Şiddeti önlemek için attığımız her adımı, kadınların eşit bireyler olarak hak ettikleri saygıyı ve özgürlüğü kazanmalarını sağlayacak bir anlayışla destekliyor; yasal düzenleme, eğitim ve farkındalık çalışmalarına önem veriyoruz. 

Aileden başlayan ve tüm topluma yayılan dayanışmayı güçlendirmek, şiddete karşı sıfır tolerans ilkesini bir yaşam kültürü hâline getirmekle mükellefiz. Kadına yönelik şiddetin olmadığı bir Türkiye için hep birlikte mücadele edeceğiz. 

25 Kasım Kadına Yönelik Şiddete Karşı Uluslararası Mücadele Günü vesilesiyle, hayatını kaybeden şiddet mağdurlarını rahmetle anarken, onurlu bir gelecek için bu sorumluluğu taşımanın hepimizin görevi olduğunu bir kez daha vurguluyorum.",Mon Nov 25 11:13:37 +0000 2024,226,40,121,https://twitter.com/NumanKurtulmus/status/1861005313870086226
1860673257050866097,NumanKurtulmus,"❝Milli ahlâkı, millî ruhu gençlerimize, eğitim sistemimizin en temel çıktılarından birisi olarak öğretmek, her birimizin en temel vazifelerinden birisidir.❞ https://t.co/yY2HP3ldk7",Sun Nov 24 13:14:08 +0000 2024,291,37,92,https://twitter.com/NumanKurtulmus/status/1860673257050866097
1860631036016677260,NumanKurtulmus,"24 Kasım Öğretmenler Günü dolayısıyla 81 ilimizden gelen kıymetli öğretmenlerimizi millî iradenin merkezi olan Gazi Meclisimizde misafir ettik. 

Bu anlamlı gün dolayısıyla bir araya geldiğimiz öğretmenlerimizin şahsında üstün bir vazife şuuruyla görev yapan eğitim ordumuzun tüm fertlerinin Öğretmenler Günü’nü kutluyorum.",Sun Nov 24 10:26:22 +0000 2024,289,40,41,https://twitter.com/NumanKurtulmus/status/1860631036016677260
1860593080686227607,NumanKurtulmus,#CANLI  Gazi Meclisimizde kıymetli öğretmenlerimizle bir aradayız https://t.co/652kXewGei,Sun Nov 24 07:55:33 +0000 2024,286,35,97,https://twitter.com/NumanKurtulmus/status/1860593080686227607
1860564027476259315,NumanKurtulmus,"Bilgi ve tecrübeleriyle yolumuzu aydınlatan, yarınlarımızın harcını yoğuran öğretmenlerimizin 24 Kasım Öğretmenler Günü'nü kutluyorum.

Biliyoruz ve inanıyoruz ki, “bana bir harf öğretenin kırk yıl kölesi olurum” diyen bir medeniyetin mensupları olarak; dün olduğu gibi bugün de öğretmenlerimiz evlatlarımızın yolunu aydınlatmaya devam edecektir. 

Bu anlamlı gün dolayısıyla tüm öğretmenlerimize özveri ve emekleri için şükranlarımı sunuyor, görevi başında şehid olan öğretmenlerimizi bir kez daha rahmetle yâd ediyorum.",Sun Nov 24 06:00:06 +0000 2024,226,32,23,https://twitter.com/NumanKurtulmus/status/1860564027476259315
1860396444798111853,NumanKurtulmus,Bir dava insanı; İsmet Uçma https://t.co/Z02VZszyre,Sat Nov 23 18:54:11 +0000 2024,281,42,71,https://twitter.com/NumanKurtulmus/status/1860396444798111853
1860350328480366716,NumanKurtulmus,❝UCM'nin kararı insan onuruna yaraşır bir mücadelenin sonucudur.❞ https://t.co/P16G8x5kGP,Sat Nov 23 15:50:56 +0000 2024,329,55,74,https://twitter.com/NumanKurtulmus/status/1860350328480366716
1860329118438416578,NumanKurtulmus,"Vefatının 3’üncü yıl dönümünde, İstanbul Milletvekilimiz İsmet Uçma’yı Pendik’te düzenlenen programla andık.

Merhum İsmet Uçma ile siyasi hayatının çok öncesinden başlayan dostluğumuz, İşaret Yayınları’ndaki derin sohbetlerimize ve çeşitli STK’ların çatısı altında on yıllara dayanan birlikteliğimize dayalıdır.

İsmet Uçma, Müslümanca yaşama gayretinde olan, mücadele eden, onurlu bir şekilde fikirlerini savunmayı hayatının merkezine koymuş, istikamet sahibi bir dava insanıydı.

Vefatının yıl dönümünde rahmetle, minnetle, özlemle anıyorum. 

Cenab-ı Allah mekânını cennet eylesin.",Sat Nov 23 14:26:39 +0000 2024,265,35,25,https://twitter.com/NumanKurtulmus/status/1860329118438416578
1860307688099577913,NumanKurtulmus,#CANLIYAYIN  Merhum İsmet Uçma'yı Anma Programı'ndayız https://t.co/madcbZJAyH,Sat Nov 23 13:01:30 +0000 2024,204,28,30,https://twitter.com/NumanKurtulmus/status/1860307688099577913
1860268181375324641,NumanKurtulmus,"Türkiye Gençlik Vakfı (TÜGVA) tarafından düzenlenen İhtisas Akademi Lansmanı'nda gençlerimizle bir araya geldik.

Türkiye’nin ve dünyanın meseleleriyle yakından ilgilenen, olaylara aynı perspektifle bakan, aynı yolda yürüyen, ülkemizi hedeflerine ulaştırmak için gayretle mücadele eden gençlerimizin yetişmesinde TÜGVA İhtisas Akademisinin büyük katkısı olduğunu biliyoruz.

Akademiye katılan tüm gençlerimize, ülkemizi azimle ileriye taşıma mücadelesinde başarılar diliyor, bu kıymetli çalışmada emeği geçenleri tebrik ediyorum.",Sat Nov 23 10:24:31 +0000 2024,677,145,71,https://twitter.com/NumanKurtulmus/status/1860268181375324641
1860238562186396022,NumanKurtulmus,TÜGVA İhtisas Akademi Lansmanı'ndayız https://t.co/HoyLLVPhqP,Sat Nov 23 08:26:49 +0000 2024,488,90,163,https://twitter.com/NumanKurtulmus/status/1860238562186396022
1859629934152392788,NumanKurtulmus,"Türk Devletleri Parlamenter Asamblesinin (TÜRKPA) 16’ncı kuruluş yıl dönümünü kutlarım. 

16 yıl evvel hayat bulan TÜRKPA, başarılı ve örnek bir uluslararası kuruluş hâline gelmiştir, TÜRKPA'yı daha da güçlendirmemiz ortak sorumluluğumuzdur. 

Daha nice kuruluş yıl dönümlerini birlik ve beraberlik içerisinde idrak etme temennisiyle kardeş Türk halklarına barış, refah ve esenlik dileklerimi sunuyorum.",Thu Nov 21 16:08:21 +0000 2024,215,38,76,https://twitter.com/NumanKurtulmus/status/1859629934152392788
1859598174756761859,NumanKurtulmus,"Uluslararası Ceza Mahkemesi’nin Gazze’deki soykırımın sorumlularından Netanyahu ve Galant hakkında verdiği yakalama kararı, tarihi öneme sahip bir adımdır.

Uluslararası Adalet Divanı’nın kararından sonra, bu kararla dokunulamaz zannedilen İsrail’e dokunulmuştur.

Bu karar, “insanlık cephesinin” masum ve mazlum Filistin halkına verdiği desteğin sonucudur.

Vicdan ve adalet kazanacak, zulüm ve barbarlık kaybedecektir.

Yakalama kararı, insanlığın geleceği adına ümit verici olduğu kadar Netanyahu ve çetesinin üzerindeki koruma kalkanının kalkacağının da habercisidir.

Ayrıca, Uluslararası Adalet Divanı ve Birleşmiş Milletler Güvenlik Konseyi kararlarına uyana kadar, soykırımcı apartheid uygulamaları nedeniyle İsrail’in Birleşmiş Milletler üyeliğinin askıya alınması, uluslararası toplum tarafından gündeme getirilmesi gereken acil bir konudur.",Thu Nov 21 14:02:09 +0000 2024,443,161,93,https://twitter.com/NumanKurtulmus/status/1859598174756761859
1859589472523813033,NumanKurtulmus,"Aile ve Sosyal Hizmetler Bakanı Mahinur Özdemir Göktaş ile Ulusal Çocuk Forumu dolayısıyla Ankara’da bulunan çocuk temsilcilerini, Türkiye demokrasisinin merkezi, millî iradenin tecelligâhı Gazi Meclisimizde ağırladık.

Bu yıl 25’incisi gerçekleştirilen Ulusal Çocuk Forumu’nun ve büyük bir emeğin sonucu olarak hazırlanan Sonuç Bildirgesi’nin, çocuk haklarıyla ilgili çalışmalara ışık tutacağına inanıyor, bildirinin hazırlanmasına katkı sunanlara teşekkür ediyorum.",Thu Nov 21 13:27:34 +0000 2024,404,49,143,https://twitter.com/NumanKurtulmus/status/1859589472523813033
1859206812731584636,NumanKurtulmus,#CANLIYAYIN  Gazi Meclisimizde basın mensuplarına açıklamalarda bulunuyoruz https://t.co/ZMjGNJuMrc,Wed Nov 20 12:07:01 +0000 2024,457,112,204,https://twitter.com/NumanKurtulmus/status/1859206812731584636
1857701326634783223,NumanKurtulmus,"Türk edebiyatının mümtaz şahsiyetlerinden Sezai Karakoç üstadımızı, vefatının yıl dönümünde rahmetle anıyorum.

Türk şiirinin başköşesinde yerini alan Sezai Karakoç, güçlü ve eşsiz şairliğinin yanı sıra modern Türk düşüncesinin büyük bir mütefekkiri, haysiyetli bir aydın ve nezaket timsali bir beyefendiydi.

İslam medeniyetinin ihyasına ömrünü vakfetmiş, ""Diriliş Nesli"" ideali doğrultusunda yazmış, anlatmış ve yaşamıştır. 

Ardında bıraktığı eşsiz külliyatından her zaman istifade edeceğimiz üstad Sezai Karakoç'un ruhu şâd, mekânı cennet olsun.",Sat Nov 16 08:24:45 +0000 2024,433,62,63,https://twitter.com/NumanKurtulmus/status/1857701326634783223
1857395278623514954,NumanKurtulmus,"Filistin Devleti’nin ilanının 36'ncı yıl dönümünü en kalbi duygularımla kutluyor, başta Gazze'de hayatını kaybeden şehidlerimiz olmak üzere, geçmişten bugüne özgür Filistin davasının tüm şehidlerini rahmetle anıyorum.

Türkiye olarak Filistinli kardeşlerimizin kendi vatanlarında, başkenti Kudüs olan bağımsız ve egemen bir Filistin Devleti çatısı altında özgürce yaşamaları için daima yanlarında olacağız.",Fri Nov 15 12:08:37 +0000 2024,379,69,52,https://twitter.com/NumanKurtulmus/status/1857395278623514954
1857371739891650886,NumanKurtulmus,"Malatya'da ve Rize'de meydana gelen depremlerden etkilenen vatandaşlarımıza geçmiş olsun dileklerimi iletiyorum.

Devletimizin ilgili tüm kurumları görevleri başında, halkımızın yanındadır.

Rabbim, ülkemizi ve milletimizi her türlü afetten muhafaza etsin.",Fri Nov 15 10:35:05 +0000 2024,200,32,114,https://twitter.com/NumanKurtulmus/status/1857371739891650886
1857326451307036688,NumanKurtulmus,"Kuzey Kıbrıs Türk Cumhuriyeti’nin 41'inci kuruluş yıl dönümünü tebrik ediyor, Kıbrıs Türklerinin bağımsızlığı ve hürriyeti için mücadele eden aziz şehidlerimizi rahmetle, kahraman gazilerimizi minnetle anıyorum.

Bu anlamlı günde bir kez daha ifade ediyoruz ki; Kıbrıs Türk halkının barış, huzur ve güven içerisinde yaşadıkları bir gelecek için haklı taleplerini ve menfaatlerini her platformda savunmaya devam edeceğiz.",Fri Nov 15 07:35:08 +0000 2024,330,43,45,https://twitter.com/NumanKurtulmus/status/1857326451307036688
1857119503769026910,NumanKurtulmus,"Kuzey Kıbrıs Türk Cumhuriyeti’nin 41'inci kuruluş yıl dönümü dolayısıyla Ankara'da düzenlenen resepsiyona katıldık.

Kıbrıs Türkü kardeşlerimizin bu iftihar gününü en içten dileklerimle tebrik ediyor, selamlarımı iletiyorum. https://t.co/grXVHvwQCq",Thu Nov 14 17:52:47 +0000 2024,274,32,39,https://twitter.com/NumanKurtulmus/status/1857119503769026910
1857097756487147524,NumanKurtulmus,#CANLIYAYIN  Kuzey Kıbrıs Türk Cumhuriyeti’nin 41’inci Kuruluş Yıl Dönümü Resepsiyonu https://t.co/BrtHVUYjvr,Thu Nov 14 16:26:23 +0000 2024,203,31,125,https://twitter.com/NumanKurtulmus/status/1857097756487147524
1857085580821020757,NumanKurtulmus,❝Türkiye’nin meselelerinin çözüm yolu Türkiye Büyük Millet Meclisi’dir.❞ https://t.co/vmGYHPjh6A,Thu Nov 14 15:38:00 +0000 2024,189,29,68,https://twitter.com/NumanKurtulmus/status/1857085580821020757
1857081952400032130,NumanKurtulmus,"❝İsrail’in, Birleşmiş Milletler kararlarını uygulayana kadar Birleşmiş Milletler üyeliğinin askıya alınmasının vakti gelmiştir.❞ https://t.co/sdhZnYe4Ze",Thu Nov 14 15:23:35 +0000 2024,275,50,42,https://twitter.com/NumanKurtulmus/status/1857081952400032130
1857051822621409685,NumanKurtulmus,"Malavi Meclis Başkanı Catherine Hara ve beraberindeki heyetle Gazi Meclisimizde bir araya geldik.

Türkiye'nin son yıllardaki Afrika açılım politikalarının çok önemli sonuçlar verdiğine şahitlik ediyoruz. Türkiye, uzun kolonyalist dönemlerden sonra Afrika’ya dostça yaklaşan ve el uzatan bir ülkedir.

Afrika politikamızın ana bakış açısı; Afrika, Afrikalılarındır.

Afrika’daki sorunların çözülmesi bakımından dışarıdan empoze edilecek bazı fikirlerin değil, Afrika halklarının kendi aralarındaki müzakerelerle, diyaloglarla geliştirecekleri çözümlerin esas olduğuna inanıyoruz. 

Malavi’den Türkiye’ye yapılan ilk üst düzey ziyaret olması bakımından da bu ziyaretin fevkalade önemli olduğunun altının çizerek Sayın Hara’ya ve heyetine ziyaretleri dolayısıyla teşekkür ediyorum.

Parlamenter diplomasinin imkânlarını en üst düzeyde kullanarak gelişecek ikili ilişkilerimizin, her alanda artmasını ve zenginleşmesini ümit ediyorum.",Thu Nov 14 13:23:51 +0000 2024,278,35,58,https://twitter.com/NumanKurtulmus/status/1857051822621409685
1856999886966665383,NumanKurtulmus,#CANLIYAYIN  Malavi Meclis Başkanı Catherine Hara ile ortak basın toplantısı https://t.co/fyRfipNTVG,Thu Nov 14 09:57:29 +0000 2024,231,38,21,https://twitter.com/NumanKurtulmus/status/1856999886966665383
1856955528158543898,NumanKurtulmus,"Gazi Meclisimizde, ABD Müslüman Organizasyonları Konseyi Başkanı Oussama Jamal ve beraberindeki Amerikalı Müslüman kanaat önderleriyle bir araya geldik.

Görüşmemizde, İslam dünyasını etkileyen güncel meseleleri ve ABD'deki Müslüman toplulukların yürüttüğü faaliyetleri ele aldık. 

Bugün Müslümanlar, gücünün farkında olarak kendi geleceklerini inşa etmeli, özellikle Filistin meselesinde İslam dünyası safları daha sıkı tutmalıdır.

İsrail'in saldırganlığına karşı durmak, Filistin meselesine bir çözüm bulabilmek için mücadeleyi her alanda sürdürmek elzemdir. 

İsrail’in uluslararası alanda yalnızlaştırılması, Filistin meselesinin sadece Müslümanların değil insanlığın ortak bir meselesi haline dönüştürülmesi için yoğun çaba içerisinde olmalıyız.",Thu Nov 14 07:01:13 +0000 2024,246,34,29,https://twitter.com/NumanKurtulmus/status/1856955528158543898
1856718586422718639,NumanKurtulmus,"Havacılık tarihimizin öncülerinden, ömrünü yerli ve millî üretime adayan Nuri Demirağ’ı, vefatının yıl dönümünde rahmetle anıyorum.

Demirağ; fedakârlığı, vizyonu ve girişimci ruhunun yanı sıra milletimize ve vatanımıza derin bağlılığı, demokrasinin ve kalkınmanın yol gösterici ilkeleriyle birleşerek bugün hâlâ saygıyla hatırlanmaktadır. 

Nuri Demirağ'ın azminden ve kararlılığından aldığımız ilhamla, her alanda daha güçlü ve tesirli bir Türkiye için çalışmaya devam edeceğiz.",Wed Nov 13 15:19:41 +0000 2024,285,45,33,https://twitter.com/NumanKurtulmus/status/1856718586422718639
1856426958810239008,NumanKurtulmus,Burdur - Isparta programımız 📹 https://t.co/yDgZ4otQ2d,Tue Nov 12 20:00:52 +0000 2024,204,28,79,https://twitter.com/NumanKurtulmus/status/1856426958810239008
1856400439282946443,NumanKurtulmus,"❝İsrail'e koşulsuz destek verenlerin bu coğrafyada yaptıkları en önemli şey İsrail'in toprak işgallerine seyirci kalmak, ona zemin hazırlamak ve ona destek olmaktır.❞ https://t.co/6jq6KvUTOH",Tue Nov 12 18:15:29 +0000 2024,207,41,59,https://twitter.com/NumanKurtulmus/status/1856400439282946443
1856391734676029537,NumanKurtulmus,Isparta Belediyesini ziyaret ederek Belediye Başkanı Şükrü Başdeğirmen'den şehirde yürütülen çalışmalar ve projeler hakkında bilgi aldık. https://t.co/ksfUqZ6q72,Tue Nov 12 17:40:54 +0000 2024,236,25,27,https://twitter.com/NumanKurtulmus/status/1856391734676029537
1856381524976791909,NumanKurtulmus,Isparta Valiliğimizi ziyaret ederek Vali Abdullah Erin’den çalışmaları hakkında bilgi aldık. Valimize ve şehrimizde görev yapan kamu personelimize görevlerinde üstün başarılar diliyorum. https://t.co/0ShTFEXRke,Tue Nov 12 17:00:20 +0000 2024,344,45,89,https://twitter.com/NumanKurtulmus/status/1856381524976791909
1856366551701528800,NumanKurtulmus,Burdur programımız kapsamında Burdur Belediyesini ziyaret ederek Başkan Ali Orkun Ercengiz'den şehirde yürütülen çalışmalar hakkında bilgi aldık. https://t.co/IRsrolTrIh,Tue Nov 12 16:00:50 +0000 2024,232,29,33,https://twitter.com/NumanKurtulmus/status/1856366551701528800
1856347674397507739,NumanKurtulmus,"Burdur Sivil Toplum Kuruluşları Buluşması’nda Burdur’un çok daha ileriye gitmesi ve potansiyelini en iyi şekilde kullanabilmesi için STK’larımızın öneri ve değerlendirmelerini dinledik.

Her birimiz üzerimize düşen sorumluluk çerçevesinde birliği ve dirliği sağlar, farklılıklarımızı zenginlik telakki edersek ortak hedeflerimiz doğrultusunda güçlü şehirleri ve güçlü büyük Türkiye’yi birlikte inşa edebiliriz. 

Toplantımızı organize eden Valiliğimize ve iştirak ederek katkı sağlayan sivil toplum kuruluşlarının temsilcilerine teşekkür ediyorum.",Tue Nov 12 14:45:49 +0000 2024,182,28,21,https://twitter.com/NumanKurtulmus/status/1856347674397507739
1856337103728054598,NumanKurtulmus,Burdur programımız kapsamında Valiliğimizi ziyaret ederek Vali Tülay Baydar Bilgihan’dan şehirde yürütülen çalışmalar hakkında bilgi aldık. Valimize ve çalışma arkadaşlarına başarılar diliyorum. https://t.co/YkngNCY04p,Tue Nov 12 14:03:49 +0000 2024,188,27,20,https://twitter.com/NumanKurtulmus/status/1856337103728054598
1856306986511704320,NumanKurtulmus,#CANLIYAYIN  Burdur'da Sivil Toplum Buluşması programındayız https://t.co/LDW1MuVi1C,Tue Nov 12 12:04:08 +0000 2024,200,30,38,https://twitter.com/NumanKurtulmus/status/1856306986511704320
1856280401053950216,NumanKurtulmus,"Burdur Mehmet Akif Ersoy Üniversitesi tarafından bu yıl 5’incisi düzenlenen Uluslararası Mehmet Akif Ersoy Bilim ve Sanat Ödülleri ve 2024-2025 Akademik Yıl Açılış Töreni dolayısıyla, Akif dostları, bilim ve sanat insanları, akademisyen ve öğrencilerle bir araya gelmekten onur duydum.

Bu anlamlı tören vesilesiyle ödüle layık görülen isimleri kutluyor, Mehmet Akif’i bir kez daha rahmetle anıyor, ödül törenini düzenleyen üniversitemize ve hocalarımıza teşekkür ediyorum.",Tue Nov 12 10:18:30 +0000 2024,241,30,78,https://twitter.com/NumanKurtulmus/status/1856280401053950216
1856250388795797837,NumanKurtulmus,#CANLIYAYIN  V. Uluslararası Mehmet Akif Ersoy Bilim ve Sanat Ödülleri Töreni ile Burdur Mehmet Akif Ersoy Üniversitesi 2024-2025 Akademik Yılı Açılış Töreni https://t.co/yMaoSL7qug,Tue Nov 12 08:19:14 +0000 2024,226,37,24,https://twitter.com/NumanKurtulmus/status/1856250388795797837
1856050756261921192,NumanKurtulmus,İzmir programımız 📹 https://t.co/9TCoIBLwqg,Mon Nov 11 19:05:58 +0000 2024,224,48,68,https://twitter.com/NumanKurtulmus/status/1856050756261921192
1856026168039813156,NumanKurtulmus,❝Dünya sistemi için yeni bir dönemin kurulması artık kaçınılmazdır.❞ https://t.co/5HJzhybwfK,Mon Nov 11 17:28:16 +0000 2024,237,55,31,https://twitter.com/NumanKurtulmus/status/1856026168039813156
1856008332206551483,NumanKurtulmus,"Tarihi Kemeraltı Çarşısı'nın güler yüzlü esnafı, İzmirli hemşehrilerimizle. 📸 https://t.co/7VxdGmSDLz",Mon Nov 11 16:17:24 +0000 2024,409,62,44,https://twitter.com/NumanKurtulmus/status/1856008332206551483
1856000477273497624,NumanKurtulmus,İzmir programımız kapsamında Valiliğimizi ziyaret ederek Vali Süleyman Elban'dan şehirde yürütülen çalışmalar ve projeler hakkında bilgi aldık. Valimize ve çalışma arkadaşlarına başarılar diliyorum. https://t.co/lfRGIoVPph,Mon Nov 11 15:46:11 +0000 2024,329,47,33,https://twitter.com/NumanKurtulmus/status/1856000477273497624
