ID,Author,Text,Date,Like_Count,Retweet_Count,Reply_Count,URL
1899902801331052820,NumanKurtulmus,"Türkiye Büyük Millet Meclisinde üniversite rektörlerimizle, gelenekselleşmeye başlayan iftar buluşmalarında bir araya gelmekten büyük bir memnuniyet duyuyorum.

Üniversitelerimizden beklentimiz; bilimin öğretildiği yerler olmanın yanı sıra yeni bir medeniyet tasavvurunun şekillendiği merkezler haline gelmeleri, gençlerin önüne bir gelecek hedefi koyarak onları harekete geçirmeleri ve toplumsal değişime öncülük ederek gelecek tasarımını en iyi şekilde yapmalarıdır.

Türkiye’nin en önemli hedeflerinden biri de bilimsel alanda dünyada güçlü ve başarılı bir yer edinmektir. Bilimde, sanatta ve kültürde insanlığa öncü bir Türkiye’yi hep beraber inşa edeceğiz ve hem milletimize hem de tarihe karşı sorumluluğumuzu yerine getireceğiz.",Wed Mar 12 19:18:20 +0000 2025,381,57,74,https://twitter.com/NumanKurtulmus/status/1899902801331052820
1899867666841784531,NumanKurtulmus,#CANLIYAYIN  Rektörlerle İftar Programı https://t.co/0j5EBQzZ32,Wed Mar 12 16:58:44 +0000 2025,159,31,66,https://twitter.com/NumanKurtulmus/status/1899867666841784531
1899825960809123960,NumanKurtulmus,"❝İstiklâl Marşı; milletimizin yürekten gelen avazıdır, haykırışıdır❞ https://t.co/1gBzlL7Jku",Wed Mar 12 14:13:00 +0000 2025,239,26,41,https://twitter.com/NumanKurtulmus/status/1899825960809123960
1899819594274984409,NumanKurtulmus,"İstiklâl Marşı’mızın kabulünün 104’üncü yıl dönümünde, yakın tarihimizin en önemli şahitlerinden biri olan I. Meclis Binamızda, “4 Şehir 4 Mekân 4 Akif Sempozyumu”nun açılışını, milletvekillerimiz, rektörlerimiz, öğrenci kardeşlerimizle gerçekleştirdik.

Hem o dönemin şartlarını en iyi şekilde anlamak hem Akif’in ülkesi ve milleti için yaptıklarını değerlendirmek hem de onun aziz hatırasını gelecek nesillere aktarmak için tertiplenen bu sempozyumda emeği geçenleri kutluyor, genç nesillere ilham vermesini diliyorum.

Mehmet Akif, milletimizin gönlündeki müstesna yerini kıyamete kadar koruyacaktır.",Wed Mar 12 13:47:42 +0000 2025,250,36,29,https://twitter.com/NumanKurtulmus/status/1899819594274984409
1899780173668749694,NumanKurtulmus,"#CANLIYAYIN  ""4 Şehir 4 Mekân 4 Akif"" Sempozyumu Açılış Programı https://t.co/MMK99pDNzh",Wed Mar 12 11:11:04 +0000 2025,111,26,25,https://twitter.com/NumanKurtulmus/status/1899780173668749694
1899732359865381185,NumanKurtulmus,"Kahraman ecdadımızın, türlü imkansızlıklara rağmen zaferle taçlandırdığı Millî Mücadele destanının adeta manifestosu olan İstiklâl Marşı’nın, Gazi Meclisimizde “millî marş” olarak kabul edilişinin 104'üncü yıl dönümünü gururla kutluyoruz.

Bu anlamlı gün vesilesiyle; Mehmet Âkif Ersoy’u ve tüm Millî Mücadele kahramanlarını bir kez daha saygıyla ve rahmetle anıyorum. 

Aziz ruhları şad olsun.",Wed Mar 12 08:01:04 +0000 2025,191,22,39,https://twitter.com/NumanKurtulmus/status/1899732359865381185
1899550797186347459,NumanKurtulmus,❝Nasıl Filistin meselesi küresel vicdanı harekete geçirdiyse; küresel iki yüzlülüğü de ortaya çıkardı❞ https://t.co/UVjwy9jMWy,Tue Mar 11 19:59:36 +0000 2025,386,65,75,https://twitter.com/NumanKurtulmus/status/1899550797186347459
1899533424748011700,NumanKurtulmus,"Ülkemizde görev yapan büyükelçilerle Gazi Meclisimizde iftar sofrasında bir araya geldik.

İftar soframızı teşriflerinden ötürü büyükelçilere teşekkür ediyor, çalışmalarında başarılar diliyorum. https://t.co/v5v06oOm07",Tue Mar 11 18:50:34 +0000 2025,325,40,152,https://twitter.com/NumanKurtulmus/status/1899533424748011700
1899503100756623532,NumanKurtulmus,#CANLIYAYIN  Büyükelçiler ile iftar https://t.co/FKlFUZ28N9,Tue Mar 11 16:50:04 +0000 2025,155,26,40,https://twitter.com/NumanKurtulmus/status/1899503100756623532
1899175432785707203,NumanKurtulmus,"Türkiye Büyük Millet Meclisi çatısı altında çalışan değerli parlamento muhabirleriyle iftar sofrasında bir araya geldik. 

Parlamentoda görev yapan gazeteci arkadaşlarımız, meclisimizin çalışmalarını büyük bir özveriyle kamuoyuna aktararak TBMM’nin faaliyetlerine önemli destek sunuyorlar. Tüm basın mensuplarına emekleri için teşekkür ediyor, çalışmalarında başarılar diliyorum.",Mon Mar 10 19:08:02 +0000 2025,375,46,101,https://twitter.com/NumanKurtulmus/status/1899175432785707203
1899140195557241314,NumanKurtulmus,#CANLIYAYIN  Parlamento Muhabirleriyle iftar https://t.co/m4f2gqMoBH,Mon Mar 10 16:48:01 +0000 2025,112,20,87,https://twitter.com/NumanKurtulmus/status/1899140195557241314
1898447445266444478,NumanKurtulmus,"8 Mart Dünya Kadınlar Günü dolayısıyla Aile ve Sosyal Hizmetler Bakanlığının ev sahipliğinde, Cumhurbaşkanımız Sayın Recep Tayyip Erdoğan’ın teşrifleriyle düzenlenen programa katıldık.

Rabbim oruçlarımızı ve dualarımızı, dergâh-ı izzetinde kabul buyursun. https://t.co/hvnT6VE6Wy",Sat Mar 08 18:55:17 +0000 2025,323,40,160,https://twitter.com/NumanKurtulmus/status/1898447445266444478
1898299057073717429,NumanKurtulmus,"Sevgi, özveri, şefkat ve merhametleriyle aileye, topluma, insanlığa ve hayata değer katan tüm kadınların #8MartDünyaKadınlarGünü’nü en içten dileklerimle kutluyorum.

Kadınlar; tarih boyunca fedakârlıklarıyla, cesaretleriyle ve azimleriyle nesilden nesile ilham kaynağı olmuş, toplumun her katmanında öncü rol üstlenmiştir.

Millî Mücadele’den Cumhuriyet’in inşasına, bilimden sanata, ekonomiden siyasete hayatın her alanında kadınların ülkemizin gelişmesine büyük katkısı olmuştur.

Bugün geldiğimiz noktada, Türkiye Büyük Millet Meclisi başta olmak üzere iş dünyasında, akademide, sanatta ve tüm yaşam alanlarında kadınların güçlü bir şekilde varlığına ve bu alanlardaki temsiliyetine tanık olmak gurur vericidir. 

Türkiye Yüzyılı olması için tüm gücümüzle gayret ettiğimiz Cumhuriyet’imizin ikinci yüzyılı, ülkemiz için büyük fırsatlar barındırıyor. Bu fırsatları kazanımlara dönüştürme mücadelesinde, kadın-erkek omuz omuza vererek daha güçlü bir gelecek inşa etmek için birlikte çalışmaya devam edeceğiz.

Ayrıca ve hassaten; başta Gazze olmak üzere yeryüzünün her tarafında akıl almaz zulümlere maruz kaldığı hâlde, heybelerindeki tükenmez ümitle -tıpkı vatanlarını koruyan Filistinli kadınlar gibi- direnen tüm kadınları #8MartDünyaKadınlarGünü vesilesiyle yürekten selamlıyorum.",Sat Mar 08 09:05:38 +0000 2025,184,24,69,https://twitter.com/NumanKurtulmus/status/1898299057073717429
1897717375224447235,NumanKurtulmus,"Sivil toplum kuruluşlarımızın kıymetli temsilcileriyle, millî iradenin tecelligâhı Gazi Meclisimizde iftar sofrasında bir araya geldik.

Ülkemiz, bugün geldiği nokta itibarıyla STK’lar bakımından önemli bir mesafe katetmiştir. Sivil toplum kuruluşlarımız, sadece bir kuruluş olmanın ötesinde, aidiyet duygusunu toplumda oluşturan en önemli unsurlarımızdan biridir.

Hedefimiz, güçlü ve büyük Türkiye’dir. İnanıyoruz ki bu hedef her zamankinden daha mümkündür. Türkiye’nin hedeflerini gerçekleştirmek için birlikte hareket etmek, yan yana yürümek üzerimize düşen tarihî sorumluluğumuzdur.

Bu birlik ve dayanışma ruhuyla, ülkemiz için çalışmaya, üretmeye ve güçlü yarınları inşa etmeye devam edeceğiz.",Thu Mar 06 18:34:14 +0000 2025,320,47,79,https://twitter.com/NumanKurtulmus/status/1897717375224447235
1897688421357044169,NumanKurtulmus,"#CANLIYAYIN   Meclisimizde, sivil toplum kuruluşlarının temsilcileriyle bir aradayız https://t.co/GUsOrkxCCi",Thu Mar 06 16:39:11 +0000 2025,317,69,65,https://twitter.com/NumanKurtulmus/status/1897688421357044169
1897629858399694966,NumanKurtulmus,"8 Mart Dünya Kadınlar Günü vesilesiyle, Gazi Meclisimizde düzenlenen Birinci Dünya Savaşı ve Kurtuluş Savaşı’nda, Kadın Kahramanlar Sergisi’nin açılışını değerli milletvekillerimizle birlikte gerçekleştirdik. 

Millî bağımsızlık mücadelemizin kahramanları ve bağımsızlığımızın kazanılmasında büyük katkıları olan Cumhuriyetimizin kurucu kadınlarını, saygıyla ve şükranla anacağımız bu anlamlı serginin açılıyor olmasından büyük memnuniyet duyuyor; hazırlanmasına emek veren herkese teşekkür ediyorum.",Thu Mar 06 12:46:29 +0000 2025,226,39,40,https://twitter.com/NumanKurtulmus/status/1897629858399694966
1897606820438622561,NumanKurtulmus,#CANLIYAYIN  Birinci Dünya Savaşı ve Kurtuluş Savaşı'nda Kadın Kahramanlar Sergisi https://t.co/WVqrZ37beE,Thu Mar 06 11:14:56 +0000 2025,205,39,31,https://twitter.com/NumanKurtulmus/status/1897606820438622561
1897384033060807113,NumanKurtulmus,"❝Türkiye’de dirliğin, birliğin sağlanması bölgemize çok büyük bir istikrar unsuru olarak büyük kazanımlar sağlayacaktır.❞

📍MÜSİAD Ankara Geleneksel İftarı https://t.co/cG2NvIesrJ",Wed Mar 05 20:29:39 +0000 2025,272,38,93,https://twitter.com/NumanKurtulmus/status/1897384033060807113
1897381271346553014,NumanKurtulmus,"❝Önümüzdeki dönemdeki gelişmeler bize gösteriyor ki, artık dünyada şirket gibi yönetilen devletlerle devletleşen şirketlerin de var olacağı bir döneme giriyoruz.❞

📍MÜSİAD Ankara Geleneksel İftarı https://t.co/NA1bH5bu56",Wed Mar 05 20:18:41 +0000 2025,277,44,50,https://twitter.com/NumanKurtulmus/status/1897381271346553014
1897372118519558608,NumanKurtulmus,"MÜSİAD Ankara Şubesinin Geleneksel İftar Programı’nda, iş dünyasının temsilcileriyle bir araya geldik.

MÜSİAD’ın, az sayıda kişiyle başlayan yolculuğunun bugün binlerce üyeye ulaşarak Türkiye’nin sivil toplum alanındaki başarılı kuruluşlardan biri olduğunu görmek büyük mutluluk verici.

Türkiye, dünyanın bu kadar önemli bir değişim evresine geçtiği dönemi, güçlü bir pozisyonda yakalamıştır. Yeni bir dünya kurulacak ve bu dünyada Türkiye sadece kendisine gösterilen yere değil, kendisinin tayin ettiği yere oturacaktır. 
Bunun için başta KOBİ'lerin öncü kuruluşlarından MÜSİAD olmak üzere hep birlikte çalışacağız, hep birlikte mücadele edeceğiz.",Wed Mar 05 19:42:19 +0000 2025,271,34,43,https://twitter.com/NumanKurtulmus/status/1897372118519558608
1897332411106726023,NumanKurtulmus,#CANLIYAYIN  MÜSİAD Ankara Geleneksel İftar Programı https://t.co/4pyoPsSvIv,Wed Mar 05 17:04:32 +0000 2025,178,37,49,https://twitter.com/NumanKurtulmus/status/1897332411106726023
1896638149951988059,NumanKurtulmus,"❝Terörsüz Türkiye hepimizin ortak hedefidir. Herhangi bir provokasyona, bu işin suistimal edilmesine fırsat vermeksizin, güçlü şekilde süreci tamamlayacağız❞ https://t.co/otf4PpzImn",Mon Mar 03 19:05:47 +0000 2025,467,87,471,https://twitter.com/NumanKurtulmus/status/1896638149951988059
1896633328427520345,NumanKurtulmus,"Millî iradenin karargâhı Gazi Meclisimizde, Mübarek Ramazan ayının manevi atmosferinde, aziz şehidlerimizin kıymetli aileleri ve kahraman gazilerimizle iftar programında bir araya geldik.

Şehidlerimiz ve gazilerimiz, bizim millî kimliğimizi bugünlere taşıyan en büyük şahitlerdir. Rabbim hepsinden razı olsun. Şehidlerimizin bereketi hürmetine bu mübarek gecede inanarak söylüyorum ki, bir olacağız, diri olacağız ve sadece oyunları bozan değil; bu milletin zihninden ve gönlünden geçen, küresel oyun kurucu bir Türkiye olacağız.

Allah Türkiye’yi tam mânâsıyla terörden kurtulduğu bir döneme getirdi. Sağlam temeller üzerinde bugüne kadar gelmiş birliğimizi ve kardeşliğimizi yeniden kuşanarak milletler topluluğu içerisinde en üst seviyede olmayı Cenab-ı Allah bu millete nasip etsin. Allah yardımcımız olsun.

Bu vesileyle bir kere daha bütün şehitlerimize rahmet diliyorum. Mekânları cennet, makamları âlî olsun.",Mon Mar 03 18:46:37 +0000 2025,329,40,74,https://twitter.com/NumanKurtulmus/status/1896633328427520345
1896602076911976884,NumanKurtulmus,#CANLIYAYIN  Gazi Meclisimizde şehidlerimizin kıymetli aileleri ve gazilerimizle bir aradayız https://t.co/PxRwv89tKE,Mon Mar 03 16:42:26 +0000 2025,235,44,96,https://twitter.com/NumanKurtulmus/status/1896602076911976884
1895921520331145500,NumanKurtulmus,"Ramazan-ı Şerif'in ilk iftarını, Sayın Cumhurbaşkanımızın ev sahipliğinde, vatan için canlarını feda eden şehidlerimizin kıymetli aileleri ve kahraman gazilerimizle birlikte açtık. Dualarımız makbul, birliğimiz daim, kardeşliğimiz baki olsun. https://t.co/O248favJFm",Sat Mar 01 19:38:09 +0000 2025,470,70,84,https://twitter.com/NumanKurtulmus/status/1895921520331145500
1895887652341309564,NumanKurtulmus,RT @RTErdogan: Şehit Aileleri ile İftar https://t.co/pk5kOa36ol,Sat Mar 01 17:23:34 +0000 2025,0,4062,0,https://twitter.com/NumanKurtulmus/status/1895887652341309564
1895538265744437314,NumanKurtulmus,"Ülkemizin öncü medya kuruluşlarından olan Kanal 7 Medya Grubu’nun 30’uncu yıl dönümü programına katıldık.

Haber ve yayıncılık alanında önemli bir yere sahip olan Kanal 7 Medya Grubu'nu ve tüm çalışanlarını tebrik ediyor, başarılarının artarak devam etmesini diliyorum. https://t.co/rLWKrp2L2v",Fri Feb 28 18:15:14 +0000 2025,201,26,37,https://twitter.com/NumanKurtulmus/status/1895538265744437314
1895520671465423199,NumanKurtulmus,RT @RTErdogan: Kanal 7 30'uncu Kuruluş Yıl Dönümü Programı https://t.co/0MxiNXqPBg,Fri Feb 28 17:05:19 +0000 2025,0,2166,0,https://twitter.com/NumanKurtulmus/status/1895520671465423199
1895492805578915943,NumanKurtulmus,"Hilal göründü. İlk teravih, ilk sahur, ilk oruç… 🌙

On bir ayın sultanı Ramazan-ı Şerif’i, asırlardır süregelen bir sevinç ve neşeyle yeniden karşılıyoruz. Bu kutlu ay; kalplere arınma, inananlara hidayet, rahmet, mağfiret ayıdır. 

Ramazan boyunca infakla iyiliği yayacak, sofralarımızı da gönüllerimizi de kardeşliğe açacak, paylaşarak ümmet olmanın idrakine varacak ve inşallah Ramazan Bayramı’na kavuşacağız.

Şehr-i Ramazan’ın; ülkemize, İslam âlemine ve tüm insanlığa hayırlar getirmesi niyazıyla, oruçlarımız makbul, sofralarımız bereketli, kardeşliğimiz daim olsun.",Fri Feb 28 15:14:36 +0000 2025,387,40,59,https://twitter.com/NumanKurtulmus/status/1895492805578915943
1895406788574314570,NumanKurtulmus,"28 Şubat, Türkiye'nin tamamına yönelmiş, kaynağını dışarıdan alan bir müdahaleydi. 

Hedefi; halkımızı ayrıştırmak, toplumsal düzeni darbecilerin kendi dar kalıplarına hapsetmekti. Ancak milletimiz bu dayatmalara boyun eğmemiştir.

Bu vesileyle vurgulamak isterim ki, ülkemizin en büyük gücü, farklılıklarına rağmen birlik içinde hareket edebilme kabiliyetidir. 

Asıl mesele, bu süreçlerden ders çıkararak daha güçlü bir demokrasi, daha sağlam bir hukuk devleti inşa etmektir.

Geçmişte yaşanan haksızlıkları unutmadık, unutmayacağız. Adalet ve ortak akıl üzerinden hep beraber bir gelecek kuracağız.

Demokrasimize vurulan her darbeyi lanetliyor, 28 Şubat ve tüm darbelerin mağdurlarını saygıyla anıyorum.",Fri Feb 28 09:32:48 +0000 2025,208,32,48,https://twitter.com/NumanKurtulmus/status/1895406788574314570
1895137527754875302,NumanKurtulmus,❝Barışın temin edilebilmesi için her türlü desteği vermeye hazırız.❞ https://t.co/uGdFbh9e9y,Thu Feb 27 15:42:51 +0000 2025,339,49,99,https://twitter.com/NumanKurtulmus/status/1895137527754875302
1895087870806728835,NumanKurtulmus,"Rusya Federasyon Konseyi Başkanı Valentina Matviyenko ile Gazi Meclisimizde bir araya gelerek ikili ve heyetler arası fevkalade faydalı görüşmeler gerçekleştirdik.

Bölgesel ve küresel konulara ilişkin son gelişmeleri ele aldığımız görüşmelerde, ülkelerimiz arasındaki birçok alandaki mevcut iş birliklerinin giderek güçlenmekte olduğunu görmekten duyduğumuz memnuniyeti belirttik. 

Parlamentolarımız arasındaki ilişkileri değerlendirdiğimiz görüşmelerde, Rusya-Ukrayna savaşında, barış için aktif rol oynayan Türkiye'nin önemini ifade ederek, barışın temin edilebilmesi için her türlü desteği vermeye hazır olduğumuzu bir kez daha ifade ettik.

Ziyaretleri dolayısıyla değerli mevkidaşım Sayın Matviyenko’ya ve beraberindeki heyete teşekkür ediyorum.",Thu Feb 27 12:25:32 +0000 2025,272,35,18,https://twitter.com/NumanKurtulmus/status/1895087870806728835
1895053897976471601,NumanKurtulmus,#CANLIYAYIN  Rusya Federasyon Konseyi Başkanı Valentina Matviyenko ile ortak basın toplantısı https://t.co/SWVrmDjC3J,Thu Feb 27 10:10:32 +0000 2025,167,24,12,https://twitter.com/NumanKurtulmus/status/1895053897976471601
1894735341505982485,NumanKurtulmus,"Hocalı Katliamı'nın 33'üncü yıl dönümünde, katledilen 613 kardeşimizin acısını yüreğimizde hissediyor, Azerbaycan halkının hüznünü paylaşıyor, kayıplarımızı rahmetle anıyoruz.

Bu vesileyle dost ve kardeş Azerbaycan'ın her platformda destekçisi olduğumuzu bir kez daha ifade ediyor, “Tek millet iki devlet” anlayışıyla dayanışmamızı ilelebet sürdürme kararlılığımızı vurguluyorum. 🇹🇷🇦🇿",Wed Feb 26 13:04:42 +0000 2025,155,22,27,https://twitter.com/NumanKurtulmus/status/1894735341505982485
1894721485643591861,NumanKurtulmus,"Bugün Gazi Meclisimizde, İstanbul 29 Mayıs Üniversitesi Hukuk Fakültesi ve İstanbul Sabahattin Zaim Üniversitesi Hukuk Fakültesi öğrencilerini ağırlamaktan büyük mutluluk duydum.

Öğrencilerimize ziyaretlerinden ötürü teşekkür ediyor, derslerinde başarılar diliyorum. https://t.co/Kybo521WJ0",Wed Feb 26 12:09:39 +0000 2025,243,38,41,https://twitter.com/NumanKurtulmus/status/1894721485643591861
1894414236601782681,NumanKurtulmus,❝Türkmenistan'ın bağımsızlığını kazandığı andan itibaren ilk tanıyan ülke Türkiye'dir❞ https://t.co/eYudYukwiC,Tue Feb 25 15:48:45 +0000 2025,288,36,52,https://twitter.com/NumanKurtulmus/status/1894414236601782681
1894384537011994930,NumanKurtulmus,"Türkmenistan Meclis Başkanı Dünyagözel Gulmanova ile Gazi Meclisimizde bir araya gelerek, baş başa ve heyetler arası son derece verimli görüşmeler gerçekleştirdik.

Dost ve kardeş Türkmenistan’ın Meclis Başkanı Gulmanova ve heyetinin ülkemizi ve Meclisimizi ziyaretinin iki ülke arasında var olan fevkalade mükemmel ilişkilerin daha da ileriye gitmesi için önemli katkılar sağlayacağını umuyorum. 

Türkmenistan ile tarihimiz, kültürümüz, dilimiz, sanatımız aynıdır ve bu müşterekliğin, sonraki nesillere aktarılmasını sağlamak da bizlerin sorumluluğudur. Bu çerçevede, parlamentolarımız arasında da parlamenter diplomasinin bütün imkânlarını kullanarak iki ülke arasında var olan bağların daha da güçlenmesini sağlayacağız. 

İkili ilişkilerimizin yanı sıra Türkmenistan olmadan hem Türk Devletleri Teşkilatı hem TÜRKPA eksik kalır, aksak kalır. Bu temennimizi, ziyareti vesilesiyle değerli kardeşimiz Gulmanova’ya ve heyetine, TBMM’nin millet adına bir temennisi olarak tekrarlıyoruz.",Tue Feb 25 13:50:44 +0000 2025,282,32,67,https://twitter.com/NumanKurtulmus/status/1894384537011994930
1894328212790153275,NumanKurtulmus,#CANLIYAYIN   Türkmenistan Meclis Başkanı Dünyagözel Gulmanova ile ortak basın toplantısı https://t.co/4ZsAjBsAZD,Tue Feb 25 10:06:55 +0000 2025,192,37,29,https://twitter.com/NumanKurtulmus/status/1894328212790153275
1894258543735312549,NumanKurtulmus,"Kayseri’de görevi esnasında geçirdiği kalp krizi nedeniyle şehid olan kahraman polis memurumuz İbrahim Birol’a Allah’tan rahmet, ailesine ve yakınlarına sabır diliyorum. Aziz milletimizin başı sağ olsun. 🇹🇷",Tue Feb 25 05:30:05 +0000 2025,223,28,22,https://twitter.com/NumanKurtulmus/status/1894258543735312549
1894048292977176693,NumanKurtulmus,"❝Anadolu irfanının, dünyaya öğretileceği bir zamandayız.❞ https://t.co/hVesRl9UV9",Mon Feb 24 15:34:37 +0000 2025,252,38,55,https://twitter.com/NumanKurtulmus/status/1894048292977176693
1894040839929946359,NumanKurtulmus,"❝Uluslararası Adalet Divanı ve Uluslararası Ceza Mahkemesi aldıkları kararlarla İsrail’in yaptıklarını sorgulamış ve İsrail’e dokunulmuştur.❞

📍 ""Küresel Sistem Arayışı ve Türkiye"" Konferansı, İstanbul Ticaret Üniversitesi https://t.co/qlG6QQKF3X",Mon Feb 24 15:05:00 +0000 2025,197,27,58,https://twitter.com/NumanKurtulmus/status/1894040839929946359
1894039581122834515,NumanKurtulmus,"❝Sadece bir ülkenin, bir milletin değil; tüm insanlığın hayrına olacak çözümleri ortaya koymak zorundayız.❞

📍 ""Küresel Sistem Arayışı ve Türkiye"" Konferansı, İstanbul Ticaret Üniversitesi https://t.co/yFZVIsyveW",Mon Feb 24 15:00:00 +0000 2025,275,45,51,https://twitter.com/NumanKurtulmus/status/1894039581122834515
1894033478078874064,NumanKurtulmus,"İstanbul Ticaret Üniversitesinde düzenlenen ""Küresel Sistem Arayışı ve Türkiye"" başlıklı konferansta, öğretim üyesi arkadaşlarım ve öğrenci kardeşlerimizle küresel meseleleri ve insanlığın yeni bir sistem ihtiyacına karşı Türkiye'nin yaklaşımlarını konuştuk.

Büyük bir iftiharla ifade etmek isterim ki, benim de uzun yıllar hocalık yaptığım İstanbul Ticaret Üniversitesi sürekli gelişerek bugün çok iyi bir noktaya geldi. Emeği geçen bütün hocalarımızı ve bütün yöneticileri tebrik ediyor, bahar yarıyılında öğrenci ve akademisyenlerimize başarılar diliyorum.",Mon Feb 24 14:35:45 +0000 2025,196,35,33,https://twitter.com/NumanKurtulmus/status/1894033478078874064
1894012791477961158,NumanKurtulmus,"Hat sanatımızın en mümtaz şahsiyetlerinden, ömrünü Hakk’ın kelâmını en güzel şekilde yazmaya adamış hattat Hasan Çelebi’ye Allah’tan rahmet; ailesine, yakınlarına ve talebelerine başsağlığı diliyorum.

Hasan Çelebi, müstesna eserleriyle, hat sanatına kattığı değerle gelecek nesillere ilham olmaya devam edecektir. 

Mekânı cennet, makamı âlî olsun.",Mon Feb 24 13:13:33 +0000 2025,392,41,30,https://twitter.com/NumanKurtulmus/status/1894012791477961158
1893986144041464220,NumanKurtulmus,"#CANLIYAYIN  İstanbul Ticaret Üniversitesinde, ""Küresel Sistem Arayışı ve Türkiye"" Konferansı'nda gençlerle bir aradayız https://t.co/zKRjJwmCOT",Mon Feb 24 11:27:39 +0000 2025,168,26,17,https://twitter.com/NumanKurtulmus/status/1893986144041464220
1893962101477302676,NumanKurtulmus,"Maarif Vakfı tarafından İstanbul’da düzenlenen 15. Ülke Temsilcileri İstişare Toplantısı’na katıldık.

Vakfımızın ve okullarımızın faaliyet gösterdiği ülkelerde edindiği kıymetli tecrübelerin paylaşılması, ortak bir bilgi birikimi ve güçlü bir vizyon oluşturulması açısından bu tür istişareler büyük önem taşıyor.

Bu değerli toplantıyı düzenleyen Maarif Vakfı yönetimine ve ülke temsilcilerine teşekkür ediyor, çalışmalarında başarılar diliyorum.",Mon Feb 24 09:52:07 +0000 2025,259,42,34,https://twitter.com/NumanKurtulmus/status/1893962101477302676
1893928239468519921,NumanKurtulmus,#CANLIYAYIN  Maarif Vakfı 15. Ülke Temsilcileri İstişare Toplantısı https://t.co/CdxM8BAa77,Mon Feb 24 07:37:34 +0000 2025,167,35,31,https://twitter.com/NumanKurtulmus/status/1893928239468519921
1892927920538067095,NumanKurtulmus,"Modern çağda ırkçılığa, ayrımcılığa ve sömürgeciliğe karşı insanlığın verdiği adalet, eşitlik ve onurlu bir yaşam mücadelesinin sembollerinden El-Hajj Malik El-Shabazz #MalcolmX’i, şehadetinin yıl dönümünde rahmetle anıyorum.

#MalcolmX, bir insanın hayatının tek bir sözcükle dahi değişeceğini kendi yaşamıyla kanıtlamış, düşünceleri ve eylemleriyle 20. yüzyılın özgürlük arayışına ilham olmuştur.

Ruhu şâd, mekânı cennet olsun.",Fri Feb 21 13:22:39 +0000 2025,206,25,40,https://twitter.com/NumanKurtulmus/status/1892927920538067095
1892643091900743759,NumanKurtulmus,Japonya programımız. 🇹🇷🇯🇵 https://t.co/sceR5iVgpC,Thu Feb 20 18:30:51 +0000 2025,327,60,119,https://twitter.com/NumanKurtulmus/status/1892643091900743759
1892222893846659148,NumanKurtulmus,"❝Asya'dan Afrika'ya, dünyanın her yerinde Türkiye'nin ayak izlerini takip eden dostlarımız var.❞ https://t.co/aZ0K8owkRX",Wed Feb 19 14:41:08 +0000 2025,291,47,61,https://twitter.com/NumanKurtulmus/status/1892222893846659148
1892190629280792775,NumanKurtulmus,"#CANLIYAYIN  Japonya, Nagoya'da TRT Haber yayınındayız https://t.co/JW12psGc1R",Wed Feb 19 12:32:55 +0000 2025,192,28,13,https://twitter.com/NumanKurtulmus/status/1892190629280792775
1892135155382341891,NumanKurtulmus,"Japonya’daki temaslarımız kapsamında, Türk vatandaşlarımızla Nagoya'da bir araya geldik. 

Vatandaşlarımızın Japonya’daki varlığının, iki ülke arasındaki dostluk ve iş birliğini daha da güçlendireceğine; kültürel etkileşimi artırarak ortak geleceğimize önemli katkılar sunacağına yürekten inanıyorum. 

Hemşehrilerimize özverili çalışmaları için teşekkür ediyor, başarılarının daim olmasını diliyorum.",Wed Feb 19 08:52:29 +0000 2025,255,32,19,https://twitter.com/NumanKurtulmus/status/1892135155382341891
1892123394923168048,NumanKurtulmus,"#CANLIYAYIN  Nagoya'da, ""Türk Toplumu Buluşması""nda kıymetli hemşehrilerimizle bir aradayız https://t.co/AoyLsr3vRZ",Wed Feb 19 08:05:45 +0000 2025,294,39,32,https://twitter.com/NumanKurtulmus/status/1892123394923168048
