ID,Author,Text,Date,Like_Count,Retweet_Count,Reply_Count,URL
1630305320848244736,PervinBuldan,RT @HDPgenelmerkezi: Hem deprem bölgelerindeyiz hem de yurttaşlarımızın yalnız kalmamasını sağlayacak dayanışma kampanyalarını örgütlemeye…,Mon Feb 27 20:34:12 +0000 2023,0,122,0,https://twitter.com/PervinBuldan/status/1630305320848244736
1629914567089311747,PervinBuldan,Ben Beşiktaşlıyım…,Sun Feb 26 18:41:29 +0000 2023,18523,757,2117,https://twitter.com/PervinBuldan/status/1629914567089311747
1628818232411844608,PervinBuldan,"Ji her demê zêdetir pêdiviya me bi piştgiriyê heye. 
 
Ez bangî gelê me dikim: Werin em dest bi dest mil bi mil birînên mexdûrên erdhejê derman bikin. https://t.co/KPpjzGQWlh",Thu Feb 23 18:05:03 +0000 2023,435,45,9,https://twitter.com/PervinBuldan/status/1628818232411844608
1628811606514704386,PervinBuldan,"Depremzedelerle birlikte yaşamı örüyoruz. 
 
Aileler arasında köprü oluyoruz. 
 
Dayanışmak isteyen herkesi depremzedelerle buluşturuyoruz.
 
Şimdi dayanışmayı daha da büyütmenin zamanı. https://t.co/zE8siMCUtj",Thu Feb 23 17:38:43 +0000 2023,757,66,16,https://twitter.com/PervinBuldan/status/1628811606514704386
1628352053922746370,PervinBuldan,RT @HDPgenelmerkezi: Eş Genel Başkanımız Pervin Buldan ve heyetimiz İskenderun'da https://t.co/7kDcYt69Ac,Wed Feb 22 11:12:37 +0000 2023,0,100,0,https://twitter.com/PervinBuldan/status/1628352053922746370
1627676457144135681,PervinBuldan,"Deprem bölgesinde insanlar can derdindeyken, iktidar ise medyayı susturma peşinde!

Tele1 hakkındaki yayın durdurma kararı halka bir cezadır, kınıyorum.  Karar derhal durdurulmalıdır.

Gerçekleri asla karartamayacaksınız.",Mon Feb 20 14:28:02 +0000 2023,1971,161,16,https://twitter.com/PervinBuldan/status/1627676457144135681
1627359342306402304,PervinBuldan,"RT @HDPAMED21: Çağrımızdır: Depremzedeler için kiraları sabit tutun!

Eş Genel Başkanlarımız Pervin Buldan ve Mithat Sancar'ın açıklaması:…",Sun Feb 19 17:27:56 +0000 2023,0,50,0,https://twitter.com/PervinBuldan/status/1627359342306402304
1626901638865723393,PervinBuldan,RT @HDPgenelmerkezi: Birecik'e giden heyetimiz açıklama yapıyor https://t.co/uJgzpw7MJU,Sat Feb 18 11:09:11 +0000 2023,0,64,0,https://twitter.com/PervinBuldan/status/1626901638865723393
1626867096368939010,PervinBuldan,Dayanışma yaşatır.. https://t.co/Ox8QmwBFJO,Sat Feb 18 08:51:56 +0000 2023,1195,44,12,https://twitter.com/PervinBuldan/status/1626867096368939010
1626681197857329155,PervinBuldan,Hacca gitmek için biriktirdiği parayı bugün Genel Merkezimize gelerek depremzedelere ulaşmak üzere bırakmış.isminin açıklanmasını istemeyen anneyi görüntülü arayarak teşekkür ettim. Yardım şovu yapanlara ibretlik bir duruş. Ellerinden öperim anne.. https://t.co/hyIJRaqDdu,Fri Feb 17 20:33:14 +0000 2023,7089,619,169,https://twitter.com/PervinBuldan/status/1626681197857329155
1626670823892299776,PervinBuldan,"RT @guneristann: HDP Genel Merkezi’ne giderek depremzedelerin neye ihtiyacı olduğu konusunda bilgi alan 80 yaşındaki bir anne, hac için bir…",Fri Feb 17 19:52:01 +0000 2023,0,60,0,https://twitter.com/PervinBuldan/status/1626670823892299776
1626322000762241027,PervinBuldan,"RT @HDPgenelmerkezi: Ne pahasına olursa olsun dayanışmaya, yaralarımızı birlikte sarmaya devam edeceğiz.

📌Islahiye ve Pazarcık https://t.c…",Thu Feb 16 20:45:55 +0000 2023,0,172,0,https://twitter.com/PervinBuldan/status/1626322000762241027
1626206534354042880,PervinBuldan,RT @HDPgenelmerkezi: Eş Genel Başkanımız Pervin Buldan ve heyetimiz yardımların engellendiği Pazarcık'a yardım ulaştırdı. Ne yaparsınız yap…,Thu Feb 16 13:07:05 +0000 2023,0,198,0,https://twitter.com/PervinBuldan/status/1626206534354042880
1625951607719399451,PervinBuldan,Tansu Çiller aklı hep aynı çalışır.,Wed Feb 15 20:14:06 +0000 2023,3292,144,78,https://twitter.com/PervinBuldan/status/1625951607719399451
1624826123166130176,PervinBuldan,"Uzaktan eğitim kararı üniveriste öğrencilerini eğitim yaşamından koparmaktır. 

Depremzedelerin barınması için bütün kamu kurumlarının ve yerel yönetimlerin imkanları devreye sokulmalı. Kira yardımı başlatılmalı. 

Eğitimi baltalama kararı derhal geri alınmalı.",Sun Feb 12 17:41:50 +0000 2023,1284,122,13,https://twitter.com/PervinBuldan/status/1624826123166130176
1624417612200288258,PervinBuldan,"RT @HDPgenelmerkezi: Eş Genel Başkanımız Pervin Buldan ile CHP Genel Başkanı Kemal Kılıçdaroğlu, Diyarbakır'da depremden etkilenen bir apar…",Sat Feb 11 14:38:33 +0000 2023,0,1338,0,https://twitter.com/PervinBuldan/status/1624417612200288258
1624402569979109384,PervinBuldan,"RT @HDPgenelmerkezi: Eş Genel Başkanımız Pervin Buldan, Diyarbakır'da.

Diyarbakır'da depremden zarar gören her bir insanımız için tüm Diya…",Sat Feb 11 13:38:47 +0000 2023,0,90,0,https://twitter.com/PervinBuldan/status/1624402569979109384
1624338078969077760,PervinBuldan,"Bileşenimiz Devrimci Parti Genel Başkanı, yoldaşımız Elif Torun Öneren’nin kızı Eylem Şafak’ın 5 gün sonra maalesef cansız bedenine ulaşıldı. 

Eylemin annesi sevgili Elif Torun Öneren ve babası Orhan Aydın başta olmak üzere tüm yakınlarına başsağlığı diliyorum. https://t.co/J7d9ss7coi",Sat Feb 11 09:22:31 +0000 2023,1959,182,21,https://twitter.com/PervinBuldan/status/1624338078969077760
1624151339927236616,PervinBuldan,An itibariyle en acil ihtiyaç Çadır ve Soba.,Fri Feb 10 21:00:29 +0000 2023,3093,741,24,https://twitter.com/PervinBuldan/status/1624151339927236616
1624110265942917122,PervinBuldan,"RT @HDPgenelmerkezi: Eş Genel Başkanımız Pervin Buldan ve milletvekillerimiz Pazarcık'ta, Silopi Belediyemizin kurduğu aş evinde yurttaşlar…",Fri Feb 10 18:17:16 +0000 2023,0,288,0,https://twitter.com/PervinBuldan/status/1624110265942917122
1623716966765629442,PervinBuldan,RT @HDPDepremKoor: Deprem Kriz Koordinasyonumuzun yardım çalışmaları aralıksız devam ediyor. Depremde mağdur olan halklarımızla dayanışmayı…,Thu Feb 09 16:14:26 +0000 2023,0,294,0,https://twitter.com/PervinBuldan/status/1623716966765629442
1623339865357123585,PervinBuldan,"OHAL ilan etmenin, sosyal medyayı kısıtlamanın, yardımları engellemenin kime faydası var? Halkın yardım çığlıklarını, feryadını bu tür yöntemlerle engellemek vicdansızlıktır. Bir an önce iletişimin ve dayanışmanın önünü açın. Gölge etmeyin bari!",Wed Feb 08 15:15:58 +0000 2023,3065,508,25,https://twitter.com/PervinBuldan/status/1623339865357123585
1623002399513227265,PervinBuldan,"Bugün Adıyaman’da insanlar acılarına terk edilmişti. Yıkılan bütün binaların önünde insanlar enkazdan çocuklarının, anne ve babalarının kurtarılmasını bekliyordu ancak ortada ne bir arama kurtarma nede bir yardım vardı. Bir anne ölen çocuğunu tül perdeye sarmıştı.",Tue Feb 07 16:55:00 +0000 2023,3972,681,137,https://twitter.com/PervinBuldan/status/1623002399513227265
1622971159548510210,PervinBuldan,"RT @HDPgenelmerkezi: Eş Genel Başkanımız Pervin Buldan, depremden zarar görmüş insanlarımızla dayanışmak için Adıyaman'da. https://t.co/Wv2…",Tue Feb 07 14:50:52 +0000 2023,0,277,0,https://twitter.com/PervinBuldan/status/1622971159548510210
1622654442322501635,PervinBuldan,"RT @HDPgenelmerkezi: Eş Genel Başkanımız Pervin Buldan, Diyarbakır’da depremin yıktığı binaların bulunduğu yerde yurttaşlarımızla görüştü.…",Mon Feb 06 17:52:21 +0000 2023,0,185,0,https://twitter.com/PervinBuldan/status/1622654442322501635
1622467879202353153,PervinBuldan,"Depremden etkilenen yurttaşlarımıza büyük geçmiş olsun dileklerimi sunuyorum. Yaşamını yitiren yurttaşlarımıza Allah’tan rahmet, yaralılara acil şifalar diliyorum. Acımız çok büyük, yüreğimiz deprem bölgesinde. Dayanışmayı büyüterek yaralarımızı saralım.",Mon Feb 06 05:31:01 +0000 2023,1783,161,12,https://twitter.com/PervinBuldan/status/1622467879202353153
1621594896762109953,PervinBuldan,RT @HDPgenelmerkezi: 4-5 Şubat'ta İstanbul Cem Karaca Gösteri Merkezi'nde gerçekleştireceğimiz Demokratik Cumhuriyet Konferansımızın progra…,Fri Feb 03 19:42:05 +0000 2023,0,90,0,https://twitter.com/PervinBuldan/status/1621594896762109953
1621195450236682240,PervinBuldan,"RT @HDPsecimisleri: Merhaba;
Yeni bir seçim sürecini daha halkımızla, seçmenlerimizle yoldaşça hep birlikte yürüteceğiz.

Sosyal Medya Hesa…",Thu Feb 02 17:14:50 +0000 2023,0,140,0,https://twitter.com/PervinBuldan/status/1621195450236682240
1621099433172819968,PervinBuldan,"Adaleti aramak suç değildir. Asıl suç, adaletin gaspıdır.

Cumartesi Anneleri'ne yarınki duruşmada verilecek ses, adaletin ve hakikatin yanındaki duruştur!

Adalet arayışı yargılanamaz!

#CumartesiAnneleri https://t.co/BY94AAIGlP",Thu Feb 02 10:53:18 +0000 2023,176,17,2,https://twitter.com/PervinBuldan/status/1621099433172819968
1619269776123265024,PervinBuldan,RT @HDPgenelmerkezi: Eş Genel Başkanımız Pervin Buldan'ın katılımıyla HDK Kadın Konferansı gerçekleşiyor https://t.co/4D2paINsgR,Sat Jan 28 09:42:53 +0000 2023,0,35,0,https://twitter.com/PervinBuldan/status/1619269776123265024
1618668754589872129,PervinBuldan,"#HazinemizHalkımız bağış kampanyamıza yoğun  katılım sağlayan halkımıza, harçlığını gönderen öğrencilerimize, yevmiyesini paylaşan emekçilerimize sonsuz teşekkür ederiz.

HALKLARIN DEMOKRATİK PARTİSİ GENEL MERKEZİ
DENİZBANK DİYARBAKIR PLAZA
TR86 0013 4000 0129 7504 9000 01 https://t.co/ptU46TuV0V",Thu Jan 26 17:54:39 +0000 2023,4820,621,302,https://twitter.com/PervinBuldan/status/1618668754589872129
1618555707821023233,PervinBuldan,Halkımız başta olmak üzere tüm İslam aleminin  #RegaipKandili'ni kutluyor; barış ve adalet içinde bir yaşama vesilesi olmasını diliyorum.,Thu Jan 26 10:25:26 +0000 2023,693,26,13,https://twitter.com/PervinBuldan/status/1618555707821023233
1616864395316936706,PervinBuldan,Hiçbir kutsala ve inanca yönelik saldırı kabul edilemez. İsveç’te İslam inancının kutsal kitabı Kuranı-ı Kerim’in yakılmasını kınıyoruz. Halkları ve inançları karşı karşıya getiren her türden kutuplaştırıcı sözün ve eylemin karşısındayız.,Sat Jan 21 18:24:46 +0000 2023,3043,234,127,https://twitter.com/PervinBuldan/status/1616864395316936706
1616086543826927616,PervinBuldan,"Hrant Dink’i andık.
Sevgi ve minnetle.. https://t.co/zki3RtHVvV",Thu Jan 19 14:53:52 +0000 2023,1060,43,24,https://twitter.com/PervinBuldan/status/1616086543826927616
1615377932129533953,PervinBuldan,"RT @HDPgenelmerkezi: Eş Genel Başkanımız Pervin Buldan, Meclis Grup Toplantımızda konuşuyor https://t.co/hsGqCj79Ij",Tue Jan 17 15:58:05 +0000 2023,0,72,0,https://twitter.com/PervinBuldan/status/1615377932129533953
1614648795622477825,PervinBuldan,"#EmekVeÖzgürlükİçin, 

Birlikte değiştirmek için bugün İstanbul'dan yola çıktık.

Geliyoruz...

Teşekkürler İstanbul. https://t.co/isbknkXIsz",Sun Jan 15 15:40:46 +0000 2023,2779,196,128,https://twitter.com/PervinBuldan/status/1614648795622477825
1613602383174451201,PervinBuldan,"RT @HDPgenelmerkezi: Eş Genel Başkanımız Pervin Buldan, İstanbul'da Yöre Dernekleri ile buluşmada konuşuyor https://t.co/ccVXhDeIE4",Thu Jan 12 18:22:42 +0000 2023,0,46,0,https://twitter.com/PervinBuldan/status/1613602383174451201
1611645076068786177,PervinBuldan,"Diyarbakır'da otobüsün devrilmesi sonucu hayatını kaybeden insanlarımıza Allah'tan rahmet, ailelerine ve Amed halkımıza başsağlığı, yaralılara acil şifalar diliyor, acınızı yürekten paylaşıyorum.",Sat Jan 07 08:45:03 +0000 2023,2174,100,42,https://twitter.com/PervinBuldan/status/1611645076068786177
1610983426730999808,PervinBuldan,"Biz gücümüzü halkımızdan alıyoruz. Daha inançlı, daha kararlı, daha güçlüyüz. Bizim hazinemiz bu davaya gönül veren milyonlardır, emekçi halkımızdır. Daha büyük geliyoruz, mutlaka değiştireceğiz. #GaspVar",Thu Jan 05 12:55:54 +0000 2023,3414,387,179,https://twitter.com/PervinBuldan/status/1610983426730999808
1610582188419956738,PervinBuldan,RT @KurdiHDP: Di 7'emîn salvegera koça wî ya dawî de em siyasetmedarê Kurd #MuratBozlak bi rêzdarî û bi rehmet bi bîr tînin. Keda wî ya di…,Wed Jan 04 10:21:31 +0000 2023,0,32,0,https://twitter.com/PervinBuldan/status/1610582188419956738
1610265530790989824,PervinBuldan,RT @HDPgenelmerkezi: Eş Genel Başkanımız Pervin #Buldan Meclis Grup Toplantımızda konuşuyor https://t.co/tiEf9xDxGX,Tue Jan 03 13:23:14 +0000 2023,0,78,0,https://twitter.com/PervinBuldan/status/1610265530790989824
1609960099019112453,PervinBuldan,"İstanbul Sözleşmesi'den çekilmeyi hukuka uygun bulan Danıştay kararı ikinci bir hukuksuzluktur.

Erkek düzenin ve yargısının aldığı kararlar biz kadınlar için yok hükmündedir!

Eşitliği de, özgürlüğü de kadın mücadelemizle kazanacağız!

#İstanbulSözleşmesindenVazgeçmiyoruz",Mon Jan 02 17:09:33 +0000 2023,467,43,18,https://twitter.com/PervinBuldan/status/1609960099019112453
1609849890288422912,PervinBuldan,"Mardin Ömerli'de meydana gelen kaza yüreğimizi dağladı. Yaşamını yitiren yurttaşlarımıza Allah'tan rahmet, acılı ailelerine sabır, yaralılara acil şifalar diliyorum. Halkımızın başı sağolsun.",Mon Jan 02 09:51:38 +0000 2023,975,31,8,https://twitter.com/PervinBuldan/status/1609849890288422912
1609835117559828480,PervinBuldan,Ben de Gultan Kışanak’ı çok seviyorum.. https://t.co/qr0zjxlmg8,Mon Jan 02 08:52:55 +0000 2023,211,16,2,https://twitter.com/PervinBuldan/status/1609835117559828480
1609219196671655936,PervinBuldan,"RT @KurdiHDP: Sala 2023'yan ji bo gelên Tirkiyeyê dê bibe sala biharê: Sala me ya nû pîroz be!

Daxuyaniya sersalê ya Hevserokên me yên Giş…",Sat Dec 31 16:05:28 +0000 2022,0,44,0,https://twitter.com/PervinBuldan/status/1609219196671655936
1609219123480772611,PervinBuldan,"RT @HDPgenelmerkezi: Eş Genel Başkanlarımız Pervin Buldan ve Mithat Sancar'ın yeni yıl mesajı:
https://t.co/H5462ij6Rm https://t.co/iTNtIGZ…",Sat Dec 31 16:05:11 +0000 2022,0,66,0,https://twitter.com/PervinBuldan/status/1609219123480772611
1608868231162523649,PervinBuldan,"Nazilli'den sonra bir acı haber de İzmir'den geldi. Bu kaza değil cinayet! İşçi sağlığı da işçi güvenliği de ihmal ediliyor bu ülkede.

Hayatını kaybeden işçi kardeşlerime Allah'tan rahmet, ailelerine sabır, yaralılara acil şifalar diliyorum. Halkımızın başı sağ olsun",Fri Dec 30 16:50:52 +0000 2022,635,45,5,https://twitter.com/PervinBuldan/status/1608868231162523649
1608850178383183873,PervinBuldan,"Aydın Nazilli'de meydana gelen patlamada yaşamını yitiren 
yurttaşlarımıza Allah'tan rahmet, acılı ailelerine sabır, yaralılara acil şifalar diliyorum. Hepimizin başı sağolsun.",Fri Dec 30 15:39:08 +0000 2022,1429,69,28,https://twitter.com/PervinBuldan/status/1608850178383183873
1608147793742381057,PervinBuldan,11.yıldönümünde Roboski’de ailelerimizle birlikte adalet çağrımızı yineledik. Roboski kanayan bir yaradır ve bu yara adalet sağlanmadan kapanmaz. https://t.co/OwGK3eNgs2,Wed Dec 28 17:08:06 +0000 2022,539,24,5,https://twitter.com/PervinBuldan/status/1608147793742381057
1608117336933908481,PervinBuldan,RT @HDPgenelmerkezi: 11'inci yılında #Roboskî Katliamı'nı anıyoruz https://t.co/K9pCdKpZ2M,Wed Dec 28 15:07:05 +0000 2022,0,179,0,https://twitter.com/PervinBuldan/status/1608117336933908481
1606554975156699138,PervinBuldan,"RT @HDPgenelmerkezi: Fransız yetkililer bir an önce katliamı aydınlatmalı

Paris'te Ahmet Kaya Kültür Merkezine gerçekleştirilen silahlı sa…",Sat Dec 24 07:38:49 +0000 2022,0,135,0,https://twitter.com/PervinBuldan/status/1606554975156699138
1606205140649795584,PervinBuldan,"Bileşenimiz DBP’ye yönelik polis baskınlarında Eş Genel Başkan Keskin Bayındır ve çok sayıda yönetici gözaltına alınmıştır.
Siyasi soykırım operasyonlarıyla DPB’yi etkisizleştirmeye çalışanlara söylüyorum: Asla başaramayacaksınız. Korkmakta haklısınız, kaybedeceksiniz.",Fri Dec 23 08:28:42 +0000 2022,542,54,0,https://twitter.com/PervinBuldan/status/1606205140649795584
1605923021838897152,PervinBuldan,"Kürt ve kadın düşmanlığıyla Semra Güzel'in vekilliğini düşürerek, 2 Mart darbecilerinin izinden giden AKP-MHP iyi bilsin ki; Semra, Amed halkının ve kadınların iradesidir. 

İradeyi düşüremezsiniz! 

Halkın iradesi karşısında asıl siz kaybedeceksiniz

#SemraGüzelHalkınVekilidir https://t.co/p8GtXCQsGj",Thu Dec 22 13:47:39 +0000 2022,1095,125,318,https://twitter.com/PervinBuldan/status/1605923021838897152
1605865775507689472,PervinBuldan,"HDP, asgari ücretin en az 12 bin 500 olmasını önerdi. Bu öneriye ve işçilerin taleplerine kulağını tıkayan iktidar, açıkladığı 8 bin 500 TL’lik rakamla çalışanlara sefaleti dayatmaktadır.  

Bu sömürü düzenini değiştireceğiz! Sosyal adaleti bu ülkede hep birlikte tesis edeceğiz.",Thu Dec 22 10:00:11 +0000 2022,2130,176,358,https://twitter.com/PervinBuldan/status/1605865775507689472
1604858314369662979,PervinBuldan,Bugün Kadıköy ilçe binamızda 2 saat boyunca ablukada kaldım. Dışarıya çıkmama izin vermediler. Bu hukuksuzluk elbet bitecek. https://t.co/yL1elWA8r4,Mon Dec 19 15:16:53 +0000 2022,4775,523,1067,https://twitter.com/PervinBuldan/status/1604858314369662979
1604812843492188164,PervinBuldan,"RT @HDPgenelmerkezi: Eş Genel Başkanlarımız Buldan ve Sancar, saldırılara karşı Kadıköy'de açıklama yapıyor https://t.co/KOguxYNwV3",Mon Dec 19 12:16:12 +0000 2022,0,202,0,https://twitter.com/PervinBuldan/status/1604812843492188164
1604476890684821504,PervinBuldan,"Hasta mahpus yakınlarının adalet nöbetinde İstanbul İl Eş Başkanımız ve Şırnak eski milletvekilimiz Ferhat Encü’ye atılan tokat, iktidardan alınan cesaretle gerçekleşti. Giderek pervasızlaşan bu saldırılar karşısında asla geri adım atmayacağız.Adalet önünde hesap vereceksiniz.",Sun Dec 18 14:01:15 +0000 2022,2146,287,883,https://twitter.com/PervinBuldan/status/1604476890684821504
1604021715935322113,PervinBuldan,"RT @HDPgenelmerkezi: Eş Genel Başkanlarımız Pervin Buldan ve Mithat Sancar, 2023 Bütçesi oylamasına katılarak sarayın ve savaşın bütçesine…",Sat Dec 17 07:52:33 +0000 2022,0,40,0,https://twitter.com/PervinBuldan/status/1604021715935322113
1603050631950127104,PervinBuldan,"Sn İmamoğlu hakkındaki karar hukuki değil, siyasidir. 

Halk iradesini yansıtan seçim sonuçlarını kayyım ve yargı darbesiyle, kumpaslarla ortadan kaldırma döneminiz kesinlikle bitecektir. 

Halkın iradesi karşısında yenileceksiniz!",Wed Dec 14 15:33:48 +0000 2022,8154,723,251,https://twitter.com/PervinBuldan/status/1603050631950127104
1601949512632860680,PervinBuldan,Evrensel ile dayanışmadan.. https://t.co/tSpSKQQrFO,Sun Dec 11 14:38:21 +0000 2022,526,36,0,https://twitter.com/PervinBuldan/status/1601949512632860680
1601479221196787712,PervinBuldan,https://t.co/zwcJyk5YMd şimdievrenselzamanı,Sat Dec 10 07:29:35 +0000 2022,144,10,0,https://twitter.com/PervinBuldan/status/1601479221196787712
1595328437769891840,PervinBuldan,Düzce'de meydana gelen ve çevre illerde de hissedilen deprem nedeniyle can kaybı olmaması tek tesellimiz. Tüm yurttaşlarımıza geçmiş olsun dileklerimizi iletiyoruz.,Wed Nov 23 08:08:33 +0000 2022,359,21,0,https://twitter.com/PervinBuldan/status/1595328437769891840
1595076413073268737,PervinBuldan,"RT @HDPgenelmerkezi: KESK Eş Genel Başkanları Mehmet Bozgeyik ve Şükran Kablan Yeşil, Eş Genel Başkanımız Pervin Buldan ve parti heyetimizl…",Tue Nov 22 15:27:06 +0000 2022,0,13,0,https://twitter.com/PervinBuldan/status/1595076413073268737
1594630557790797824,PervinBuldan,"RT @HDPkadin: Polisin engellemelerine rağmen arkadaşlarımızın yanında, Kobanî Kumpas Davası duruşmasındayız. Kadın özgürlük mücadelemiz kaz…",Mon Nov 21 09:55:26 +0000 2022,0,51,0,https://twitter.com/PervinBuldan/status/1594630557790797824
1592930619683926016,PervinBuldan,RT @HDPgenelmerkezi: Alevi toplumunun eşit yurttaşlık taleplerinin inkar edildiği torba yasayı reddediyoruz. Sonuna kadar haklarının savunu…,Wed Nov 16 17:20:29 +0000 2022,0,107,0,https://twitter.com/PervinBuldan/status/1592930619683926016
1592494317637083136,PervinBuldan,"RT @HDPgenelmerkezi: Eş Genel Başkanımız Pervin #Buldan, Meclis Grup Toplantımızda konuşuyor https://t.co/fSXd0jZDSb",Tue Nov 15 12:26:47 +0000 2022,0,81,0,https://twitter.com/PervinBuldan/status/1592494317637083136
1591442393177391106,PervinBuldan,"RT @HDPgenelmerkezi: Önceki dönem Eş Genel Başkanımız Selahattin Demirtaş, rahatsızlanan anne ve babasını görmesi için dün akşam Diyarbakır…",Sat Nov 12 14:46:48 +0000 2022,0,385,0,https://twitter.com/PervinBuldan/status/1591442393177391106
1591393344843911171,PervinBuldan,"Erzurum Karayazı’da esnafımıza da, halkımıza da sonsuz teşekkür ediyorum. https://t.co/NbEPLxZokS",Sat Nov 12 11:31:54 +0000 2022,704,51,0,https://twitter.com/PervinBuldan/status/1591393344843911171
1591122133497057280,PervinBuldan,Ardahan Esnafına ayrıca teşekkür ediyorum. https://t.co/VuCJRGfxC6,Fri Nov 11 17:34:12 +0000 2022,504,17,0,https://twitter.com/PervinBuldan/status/1591122133497057280
1591107941394190336,PervinBuldan,Ardahan halkımıza ilgisinden dolayı çok teşekkürler. https://t.co/BrWbKeJ8d1,Fri Nov 11 16:37:49 +0000 2022,361,16,0,https://twitter.com/PervinBuldan/status/1591107941394190336
1591035864775262208,PervinBuldan,"RT @HDPgenelmerkezi: Eş Genel Başkanımız Pervin #Buldan, Ardahan halk buluşmamızda konuşuyor https://t.co/tnuuNkZRNc",Fri Nov 11 11:51:24 +0000 2022,0,46,0,https://twitter.com/PervinBuldan/status/1591035864775262208
1590959803018678272,PervinBuldan,"RT @GazeteKarinca: Çocukluk kahramanlarıma saygıyla

✍️Evin Jiyan Kışanak yazdı

https://t.co/uxQrRHEZfg",Fri Nov 11 06:49:10 +0000 2022,0,11,0,https://twitter.com/PervinBuldan/status/1590959803018678272
1590598914180542464,PervinBuldan,"Girtiyê nexweş Mehmet Emîn Ozkan ev 27 sale niheqî di zindanê de tê girtin. Vê zilmê bi dawî bikin, Mehmet Emîn Ozkan serbest berdin. Ji Mehmet Emîn Ozkan re azadî. #EminÖzkanaÖzgürlük https://t.co/Tc1uzntsHq",Thu Nov 10 06:55:07 +0000 2022,370,58,0,https://twitter.com/PervinBuldan/status/1590598914180542464
1589717925627588609,PervinBuldan,"RT @HDPgenelmerkezi: Tutak’taki feci kaza yüreğimizi dağladı; halkımızın başı sağ olsun
￼
Eş Genel Başkanlarımız Pervin #Buldan ve Mithat #…",Mon Nov 07 20:34:23 +0000 2022,0,50,0,https://twitter.com/PervinBuldan/status/1589717925627588609
1588167068150644739,PervinBuldan,"RT @HDPgenelmerkezi: Eş Genel Başkanlarımız #Buldan ve #Sancar Almanya Dışişleri Bakanlığı Direktörü ile görüştü
https://t.co/zB3hLfgMtK",Thu Nov 03 13:51:50 +0000 2022,0,23,0,https://twitter.com/PervinBuldan/status/1588167068150644739
1588101128209801218,PervinBuldan,"RT @HDPgenelmerkezi: Cumhuriyetle değil tekçi, inkarcı ve anti demokratik karakteriyle sorunumuz var

Parti Sözcümüz Ebru Günay'ın açıklama…",Thu Nov 03 09:29:49 +0000 2022,0,65,0,https://twitter.com/PervinBuldan/status/1588101128209801218
1587778536059928577,PervinBuldan,"RT @HDPgenelmerkezi: Eş Genel Başkanımız Pervin Buldan ve yöneticilerimizle, 9 muhabiri tutuklanan MA ve Jinnews bürosunu ziyaret ediyoruz.…",Wed Nov 02 12:07:57 +0000 2022,0,45,0,https://twitter.com/PervinBuldan/status/1587778536059928577
1587464957377093632,PervinBuldan,"RT @HDPgenelmerkezi: Eş Genel Başkanımız Pervin #Buldan ve Grup Başkanvekilimiz Saruhan Oluç, Damal Dernekler Federasyonu üyelerini kabul e…",Tue Nov 01 15:21:54 +0000 2022,0,13,0,https://twitter.com/PervinBuldan/status/1587464957377093632
1587429045083447302,PervinBuldan,"RT @HDPgenelmerkezi: Eş Genel Başkanımız Pervin #Buldan, Meclis Grup Toplantımızda konuşuyor https://t.co/WljL50tAZD",Tue Nov 01 12:59:12 +0000 2022,0,59,0,https://twitter.com/PervinBuldan/status/1587429045083447302
1586379867389513728,PervinBuldan,"RT @meraldanis: Mardin milletvekilimiz Gülser Yıldırım 4 Kasım 2016 darbesinden bu yana Cezaevindeydi. 
Haksız verilen cezanın İnfazını faz…",Sat Oct 29 15:30:08 +0000 2022,0,39,0,https://twitter.com/PervinBuldan/status/1586379867389513728
1586362802213515264,PervinBuldan,Mardin Milletvekilimiz sevgili Gülser Yıldırım cezaevinden çıktı. Bugün Mardin’deki evinde ziyaret ettik. https://t.co/0wtkLdnAmP,Sat Oct 29 14:22:19 +0000 2022,730,41,0,https://twitter.com/PervinBuldan/status/1586362802213515264
1586290180704456704,PervinBuldan,"Her biriyle ayrı ayrı röportajlarım oldu. Bugün hepsi tutuklular. Ne sansür yasaları ne de tutuklamalar gerçeklerin halka ulaşmasına engel olamaz.
#GazetecilikSucDegildir https://t.co/FVj1f1tU5N",Sat Oct 29 09:33:45 +0000 2022,273,35,0,https://twitter.com/PervinBuldan/status/1586290180704456704
1585957002588479488,PervinBuldan,Sevgili Aysel Tuğluk’u ziyaret ettik. Sağlığına kavuşması en büyük dileğimiz… https://t.co/tA5lQMotZD,Fri Oct 28 11:29:49 +0000 2022,1417,119,0,https://twitter.com/PervinBuldan/status/1585957002588479488
1585686176974905346,PervinBuldan,Geçmiş olsun sevgili Aysel. Hoşgeldin.. https://t.co/mh1y4fd8eJ,Thu Oct 27 17:33:39 +0000 2022,739,31,0,https://twitter.com/PervinBuldan/status/1585686176974905346
