ID,Author,Text,Date,Like_Count,Retweet_Count,Reply_Count,URL
1759590339290038349,PervinBuldan,"RT @ArtiTV_: 🔴@Kemalav ile #SiyasetÖtesi başladı

📌Pervin Buldan'ın günlük hayatı, unutulmaz anıları, gelecek planları
📌Siyaseti bırakıyor…",Mon Feb 19 14:46:43 +0000 2024,0,5,0,https://twitter.com/PervinBuldan/status/1759590339290038349
1758959591189029139,PervinBuldan,"RT @DEMGenelMerkezi: Kayyımlardan, rant çetelerinden kurtulmak için her oyun değeri var. Oy vereceğin yerden uzaksan bizi ara seni sandığın…",Sat Feb 17 21:00:21 +0000 2024,0,401,0,https://twitter.com/PervinBuldan/status/1758959591189029139
1758920291068096766,PervinBuldan,"RT @ArtiTV_: 🔴@Kemalav ile #SiyasetÖtesi'nin konuğu DEM Parti Van Milletvekili Pervin Buldan.

📌Buldan'ın günlük hayatı, unutulmaz anıları,…",Sat Feb 17 18:24:11 +0000 2024,0,6,0,https://twitter.com/PervinBuldan/status/1758920291068096766
1758891940790104106,PervinBuldan,Dünya Kediler Günü kutlu olsun.. https://t.co/fyfb0rxrPU,Sat Feb 17 16:31:31 +0000 2024,449,10,0,https://twitter.com/PervinBuldan/status/1758891940790104106
1758820959442653605,PervinBuldan,Ankara adayımız sevgili Gultan Kışanak ilk mesajını gönderdi. Ankara halkının Gultan Başkanı sahipleneceğinden hiç bir kuşkumuz yok. Serkeftin..,Sat Feb 17 11:49:28 +0000 2024,406,21,0,https://twitter.com/PervinBuldan/status/1758820959442653605
1756937843669090312,PervinBuldan,Uzun süre cezaevinde kaldıktan sonra tahliye olan İbrahim Ete arkadaşımızı Van’daki evinde ziyaret ettik. https://t.co/VjZVyd6rch,Mon Feb 12 07:06:38 +0000 2024,211,7,0,https://twitter.com/PervinBuldan/status/1756937843669090312
1756764424356954275,PervinBuldan,"RT @mkgdernek: Gazeteci Kibriye Evren'in emniyet işlemleri tamamlandı, yarın adliyeye getirilmesi bekleniyor.  #KibriyeEvren #GazetecilikYa…",Sun Feb 11 19:37:32 +0000 2024,0,45,0,https://twitter.com/PervinBuldan/status/1756764424356954275
1756628265324646847,PervinBuldan,Van İl Örgütümüzde yönetime seçilen arkadaşlarımıza ziyaret yapan halkımızla sohbet.. https://t.co/rIoExcxp1c,Sun Feb 11 10:36:29 +0000 2024,105,3,0,https://twitter.com/PervinBuldan/status/1756628265324646847
1756266366158491663,PervinBuldan,Parti Sözcümüz sevgili Ayşegül Doğan’ın katılımıyla Van il örgütümüzün 2. Olağan Kongresini gerçekleştirdik. Yönetime seçilen bütün arkadaşlarıma başarılar diliyorum. https://t.co/5WrI4PQcTg,Sat Feb 10 10:38:26 +0000 2024,327,14,0,https://twitter.com/PervinBuldan/status/1756266366158491663
1755948518169059387,PervinBuldan,Van Organize Sanayi Bölge ziyaretimizden. https://t.co/LrMJrsQnDw,Fri Feb 09 13:35:25 +0000 2024,50,1,0,https://twitter.com/PervinBuldan/status/1755948518169059387
1755934896810295518,PervinBuldan,Van Organize Sanayi Kooperatifini ziyaret ettik. https://t.co/5JIXHho5tx,Fri Feb 09 12:41:17 +0000 2024,64,3,0,https://twitter.com/PervinBuldan/status/1755934896810295518
1755618325764116502,PervinBuldan,Van TTB ziyaretimizden https://t.co/3jshz1srH0,Thu Feb 08 15:43:21 +0000 2024,41,1,0,https://twitter.com/PervinBuldan/status/1755618325764116502
1755604060684914891,PervinBuldan,Van Eczacılar odası ziyaretimizden. https://t.co/FKlKdcFjHr,Thu Feb 08 14:46:40 +0000 2024,72,3,0,https://twitter.com/PervinBuldan/status/1755604060684914891
1755588639923339653,PervinBuldan,Van THİV ziyaretimizden https://t.co/gGA7cEjIRN,Thu Feb 08 13:45:23 +0000 2024,78,2,0,https://twitter.com/PervinBuldan/status/1755588639923339653
1755580559919624371,PervinBuldan,Belediye Eş Başkan adaylarımızla birlikte iHD Van şubesini ziyaret ettik. https://t.co/RWRNCwof0P,Thu Feb 08 13:13:17 +0000 2024,95,2,0,https://twitter.com/PervinBuldan/status/1755580559919624371
1755563821266092514,PervinBuldan,Van’da adalet nöbetinde olan annelerimizi ziyaret ettik. https://t.co/0KFKaxqXgQ,Thu Feb 08 12:06:46 +0000 2024,256,6,0,https://twitter.com/PervinBuldan/status/1755563821266092514
1754914169264930948,PervinBuldan,"Halklarımızın #MiracKandili kutlu olsun.
Mübarek gecenin tüm dünyaya barış, sağlık ve huzur getirmesine vesile olsun.",Tue Feb 06 17:05:17 +0000 2024,151,3,0,https://twitter.com/PervinBuldan/status/1754914169264930948
1748441182022070584,PervinBuldan,"RT @KarerEngin: Ape Musa ve Savaş Buldan aynı karede...

Buldan ve arkadaşlarının cenazeleri, 4 Haziran 1994'te Bolu'nun Yığılca ilçesi Mel…",Fri Jan 19 20:23:56 +0000 2024,0,56,0,https://twitter.com/PervinBuldan/status/1748441182022070584
1748257570970538040,PervinBuldan,"17 yıl önce Hrant Dink namertçe katledildi. Sevgiyle, minnetle anıyorum.. https://t.co/zIrniOPdPV",Fri Jan 19 08:14:20 +0000 2024,1197,65,0,https://twitter.com/PervinBuldan/status/1748257570970538040
1747996986265977213,PervinBuldan,Namertçe..,Thu Jan 18 14:58:52 +0000 2024,3712,342,230,https://twitter.com/PervinBuldan/status/1747996986265977213
1746201804189143435,PervinBuldan,RT @DEMGenelMerkezi: Pêşhilbijartinên me serkeftî didom in. Em bi gelê xwe serfiraz in. Tu kes nikare îradeya vê gelê tûne bike. Bi pêşhilb…,Sat Jan 13 16:05:27 +0000 2024,0,95,0,https://twitter.com/PervinBuldan/status/1746201804189143435
1742157175168872944,PervinBuldan,"Emeğine, kalemine sağlık..",Tue Jan 02 12:13:32 +0000 2024,385,13,1,https://twitter.com/PervinBuldan/status/1742157175168872944
1741940798348767352,PervinBuldan,"RT @DemPartiKadin: Yoldaşımız Başak Demirtaş hakkında sosyal medyada yapılan cinsiyetçi, hakaret içerikli paylaşımı şiddetle kınıyoruz. 
Ya…",Mon Jan 01 21:53:44 +0000 2024,0,380,0,https://twitter.com/PervinBuldan/status/1741940798348767352
1741459164537278633,PervinBuldan,Acı bir veda.. https://t.co/aboqs6Z4sS,Sun Dec 31 13:59:54 +0000 2023,4300,213,0,https://twitter.com/PervinBuldan/status/1741459164537278633
1741389247884464165,PervinBuldan,Sevgili Selahattin Demirtaş’ın kıymetli babası Tahir amcanın vefatından dolayı çok üzgünüm. Mekanı cennet olsun.. https://t.co/TATPgAZRRb,Sun Dec 31 09:22:04 +0000 2023,4737,192,0,https://twitter.com/PervinBuldan/status/1741389247884464165
1740318363656819030,PervinBuldan,Roboski kanayan bir yaradır. Asla unutulacak bir mesele değildir. Failler ceza alana kadar mücadele edilecek.. https://t.co/ZZAzDSbnaZ,Thu Dec 28 10:26:46 +0000 2023,895,47,0,https://twitter.com/PervinBuldan/status/1740318363656819030
1738229768762597574,PervinBuldan,Fener Günana arkadaşımızın taziyesindeydik. Mekanı cennet olsun. https://t.co/fqn6wiSaea,Fri Dec 22 16:07:26 +0000 2023,257,14,0,https://twitter.com/PervinBuldan/status/1738229768762597574
1736329423618490688,PervinBuldan,Mekanı cennet olsun.Fener Günana arkadaşımıza rahmet ailesine başsağlığı diliyorum..,Sun Dec 17 10:16:08 +0000 2023,228,8,0,https://twitter.com/PervinBuldan/status/1736329423618490688
1736014124063097268,PervinBuldan,Tekirdağ ilimizin 2. Olağanüstü kongresinde yönetime seçilen bütün arkadaşlarıma başarılar dilerim.. https://t.co/jVV1Xkt6Er,Sat Dec 16 13:23:15 +0000 2023,189,6,0,https://twitter.com/PervinBuldan/status/1736014124063097268
1735299218674266505,PervinBuldan,"Saadet Partisi Kocaeli Milletvekili ve  Genel Başkan yardımcısı olan Hasan Bitmez'in vefatından dolayı ailesine, sevenlerine ve tüm Saadet Partisi camiasına başsağlığı ve sabır diliyorum. https://t.co/1NcxGaH85q",Thu Dec 14 14:02:28 +0000 2023,348,10,0,https://twitter.com/PervinBuldan/status/1735299218674266505
1734951167694700875,PervinBuldan,"Herbirinizin büyük emeği ve alın teri ile yoğrulmuş, büyümüş bugünlere gelmiş bir mücadele süreci. Emeğinize ve yüreğinize saglik..@DEMPartiWan",Wed Dec 13 14:59:26 +0000 2023,197,8,0,https://twitter.com/PervinBuldan/status/1734951167694700875
1734661884312166551,PervinBuldan,Yaşamını yitiren Avcılar İlçe Eş Başkanımız Yalçın Gültekin’e Allah’tan rahmet ailesine başsağlığı dileklerimi iletiyorum. https://t.co/KdbWE5qSBv,Tue Dec 12 19:49:56 +0000 2023,607,18,0,https://twitter.com/PervinBuldan/status/1734661884312166551
1730568559728755156,PervinBuldan,Antalya İl Örgütümüzü ziyaret ettim.. https://t.co/II0JI30Tbw,Fri Dec 01 12:44:31 +0000 2023,301,9,0,https://twitter.com/PervinBuldan/status/1730568559728755156
1729474080200417639,PervinBuldan,"RT @bianet_org: 📢 Buldan’dan İçişleri Bakanı Yerlikaya’ya “Cumartesi Anneleri” soruları

👉🏼 HEDEP Van Milletvekili Pervin Buldan, Cumartesi…",Tue Nov 28 12:15:27 +0000 2023,0,3,0,https://twitter.com/PervinBuldan/status/1729474080200417639
1729473052847505843,PervinBuldan,"RT @mercanargunaga: Değerli Başkanımız Selahattin Demirtaş'ın, barışın elçisi Tahir Elçi anısına söz ve müziğini yaptığı ""Elçi'ye Ağıt"" ese…",Tue Nov 28 12:11:22 +0000 2023,0,701,0,https://twitter.com/PervinBuldan/status/1729473052847505843
1728429755060699583,PervinBuldan,İstanbul Mecidiyeköy. 25 Kasım Uluslararası Kadına Karşı Şiddetle Mücadele Günü. https://t.co/J4FF11i2F2,Sat Nov 25 15:05:40 +0000 2023,269,24,0,https://twitter.com/PervinBuldan/status/1728429755060699583
1728389116197560708,PervinBuldan,Kongresini yakın zamanda yapan İstanbul İl Örgütümüzü ziyaret ettik.. https://t.co/xSB38BOGFd,Sat Nov 25 12:24:11 +0000 2023,211,10,0,https://twitter.com/PervinBuldan/status/1728389116197560708
1728381235377185187,PervinBuldan,"Bugün Cumartesi Anneleri yine temsili olarak Galatasaray Meydanında açıklama yaptılar. Eş Başkanımız Tülay Hatimoğulları, Kezban Konukçu ve İstanbul İl Örgütümüzle Annelerimizi İHD’de ziyaret ettik.Dayanışma her zaman, her yerde.. https://t.co/DWuPrlP9tv",Sat Nov 25 11:52:52 +0000 2023,266,22,0,https://twitter.com/PervinBuldan/status/1728381235377185187
1728159252806525282,PervinBuldan,"RT @Ayla_Akat: Sincan kadın kapalı cezaevinden mücadeleyi büyüten tüm halkımıza selam ve sevgilerimi iletiyorum.
Jin, jîyan, azadî! https:/…",Fri Nov 24 21:10:48 +0000 2023,0,309,0,https://twitter.com/PervinBuldan/status/1728159252806525282
1728074147001970766,PervinBuldan,Yenikapı Van Günleri https://t.co/wjB0ESaIVV,Fri Nov 24 15:32:37 +0000 2023,374,12,0,https://twitter.com/PervinBuldan/status/1728074147001970766
1728066735142498564,PervinBuldan,Yenikapı Van Günleri https://t.co/xQkbjvJOE5,Fri Nov 24 15:03:10 +0000 2023,194,9,0,https://twitter.com/PervinBuldan/status/1728066735142498564
1728066403763204427,PervinBuldan,"Bugün gün boyunca İstanbul Yenikapı’da Van Günleri Fuarını dolaştık. Van’ın her ilçesinin standına uğradık. Van peyniri, tandır ekmeği ve keledoş yedik. Emeği geçen herkese teşekkürler.. https://t.co/gxQymbjI8f",Fri Nov 24 15:01:51 +0000 2023,172,10,0,https://twitter.com/PervinBuldan/status/1728066403763204427
1728065411105882175,PervinBuldan,RT @ronikaya65: Sayın Pervin Buldan'a O Hal'de gazetecilik adlı kitabımı takdim ettim. @HEDEPdestek  @PervinBuldan https://t.co/Imirv1wGdp,Fri Nov 24 14:57:54 +0000 2023,0,2,0,https://twitter.com/PervinBuldan/status/1728065411105882175
1727035179506815325,PervinBuldan,25 Kasım vesilesiyle bugün Kadın Grup Toplantımızı yaptık. https://t.co/mH0CdQprk6,Tue Nov 21 18:44:08 +0000 2023,273,16,0,https://twitter.com/PervinBuldan/status/1727035179506815325
1726506702034600337,PervinBuldan,Geçmiş olsun Batman. https://t.co/f4KH5W1TbK,Mon Nov 20 07:44:09 +0000 2023,1635,56,0,https://twitter.com/PervinBuldan/status/1726506702034600337
1726326868625039512,PervinBuldan,"HEDEP Myk üyelerimiz İlknur Birol ve Murat Mıhçı ile birlikte İstanbul Kadıköy'de Süreyya Opera Sahnesi'nde ünlü soprano Pervin Chakar ve piyanist Paolo Villa'nın ""Bir Opera Gecesi"" dinletisine katıldık.
Muhteşem bir performans. https://t.co/jxqCc42eSX",Sun Nov 19 19:49:33 +0000 2023,882,30,0,https://twitter.com/PervinBuldan/status/1726326868625039512
1725251446294429879,PervinBuldan,Erdal Sefalı’ya Allah’tan rahmet diliyorum. Yakınlarına başsağlığı dileklerimi iletiyorum. Büyük bir acı. Mekanı cennet olsun..,Thu Nov 16 20:36:13 +0000 2023,124,2,0,https://twitter.com/PervinBuldan/status/1725251446294429879
1724905478256505309,PervinBuldan,"Ogün Samast bir katil ve iyi halden serbest. Bu Ülke bir utanca daha imza attı. Sevgili Rakel Dink’in acısı yeniden kanamaya başladı bu gece. Demirtaş, Kışanak, Atalay, infazı yakılanlar, hasta tutuklular,binlerce insan suçsuz. Adalet ayaklar altında..",Wed Nov 15 21:41:27 +0000 2023,760,56,0,https://twitter.com/PervinBuldan/status/1724905478256505309
1723723204005339163,PervinBuldan,HEDEP İstanbul İl Kongremizde İl Eşbaşkanlığına ve yönetime seçilen bütün arkadaşlarıma başarılar diliyorum.. https://t.co/mo5bpwdjM7,Sun Nov 12 15:23:31 +0000 2023,521,20,0,https://twitter.com/PervinBuldan/status/1723723204005339163
1723447309839618455,PervinBuldan,"RT @ihdistanbul: Kalp rahatsızlığı nedeniyle aort anevrizma ameliyatı olan ve kalbi besleyen ana damarı değiştirilen Can için doktorları, ""…",Sat Nov 11 21:07:13 +0000 2023,0,110,0,https://twitter.com/PervinBuldan/status/1723447309839618455
1723283536260612109,PervinBuldan,RT @KeskinEren1: Sonunda….#CumartesiAnneleri972Hafta,Sat Nov 11 10:16:26 +0000 2023,0,351,0,https://twitter.com/PervinBuldan/status/1723283536260612109
1722968712129441883,PervinBuldan,"Sürgünde olan Van Belediye Eşbaskanımız Bedia Özgökçe Ertanın Van’da ailesini, kıymetli annesini ziyaret ettik.. https://t.co/EaEUcCfGkr",Fri Nov 10 13:25:26 +0000 2023,356,5,0,https://twitter.com/PervinBuldan/status/1722968712129441883
1722967918126723432,PervinBuldan,"RT @WanHDP: Halkımız partimize yol haritasını çiziyor. 

#Hedep  Van milletvekilimiz Pervin Buldan, DBP  il Eş Başkanımız Harun Okay, HDP İ…",Fri Nov 10 13:22:17 +0000 2023,0,10,0,https://twitter.com/PervinBuldan/status/1722967918126723432
1722941053697765681,PervinBuldan,Van Çaldıranda yağmurlu havaya rağmen esnafın sıcak yüreğine teşekkür ederim.. https://t.co/w421C8AmBr,Fri Nov 10 11:35:32 +0000 2023,219,1,0,https://twitter.com/PervinBuldan/status/1722941053697765681
1722644087268843634,PervinBuldan,Van Bahcesaray ve Çatak İlçelerimizde esnaflarımızı ziyaret ettik.. https://t.co/z6Ey31PEta,Thu Nov 09 15:55:30 +0000 2023,203,6,0,https://twitter.com/PervinBuldan/status/1722644087268843634
1722615405792149608,PervinBuldan,Van Bahçesaray İlçesi esnaf ziyareti.. https://t.co/kcjBMZPdhz,Thu Nov 09 14:01:32 +0000 2023,160,2,0,https://twitter.com/PervinBuldan/status/1722615405792149608
1722270836978249801,PervinBuldan,Tutuklu bulunan HDP eski İl Eşbaşkanı Yadişan Karabulak’ın ailesini ziyaret ettik.. https://t.co/sIr73y353F,Wed Nov 08 15:12:20 +0000 2023,369,7,0,https://twitter.com/PervinBuldan/status/1722270836978249801
1722236714629136718,PervinBuldan,Nizam Karaağar 30 yıllık cezaevi sürecinden sonra tahliye oldu. Van’da evinde ziyaret ettik.. https://t.co/ZJJkwPMdAd,Wed Nov 08 12:56:45 +0000 2023,426,7,0,https://twitter.com/PervinBuldan/status/1722236714629136718
1722217913963442599,PervinBuldan,"Van’da MEBYA-DER, TUHAY-DER’in ortaklaşa düzenlediği etkinlikte kıymetli ailelerimizle bir araya geldik.. https://t.co/KqmecM4Hwu",Wed Nov 08 11:42:02 +0000 2023,157,8,0,https://twitter.com/PervinBuldan/status/1722217913963442599
1721847290879439159,PervinBuldan,"RT @HEDEPdestek: Grup toplantımız başladı. İzleyelim, paylaşalım ✌️",Tue Nov 07 11:09:19 +0000 2023,0,10,0,https://twitter.com/PervinBuldan/status/1721847290879439159
1721552373301030957,PervinBuldan,"Kardeşimin hünerli ellerinden, kara kaleminden. Teşekkürler https://t.co/a9LOurVdGc",Mon Nov 06 15:37:25 +0000 2023,1204,11,0,https://twitter.com/PervinBuldan/status/1721552373301030957
1720382506795499988,PervinBuldan,"Sevgili Figen Yüksekdağ Ağabeyi Necmi Yüksekdağ’ın cenaze törenine katıldı. Yanında olduk, acısını paylaştık. Mekanı cennet olsun. https://t.co/IM60dPhzkA",Fri Nov 03 10:08:47 +0000 2023,1384,90,0,https://twitter.com/PervinBuldan/status/1720382506795499988
1714918567022415887,PervinBuldan,İstanbul - Van Kültür Ve Dayanışma Vakfına vermiş oldukları plaketten dolayı teşekkür ederim. https://t.co/8bMlPLe8RM,Thu Oct 19 08:17:02 +0000 2023,354,7,0,https://twitter.com/PervinBuldan/status/1714918567022415887
1713538359811879085,PervinBuldan,Kongremizi büyük bir coşkuyla gerçekleştirdik. Seçilen Eş Genel Başkanlarımız başta olmak üzere yönetime üstün başarılar diliyorum. HADEP’ten HEDEP’e yolumuz açık olsun.. https://t.co/Wyy7ujJAyY,Sun Oct 15 12:52:35 +0000 2023,620,26,0,https://twitter.com/PervinBuldan/status/1713538359811879085
1708157246775955636,PervinBuldan,"Tarifsiz bir acıdır sevgili Eren. Sizinki de, bizimki de..",Sat Sep 30 16:29:58 +0000 2023,347,24,0,https://twitter.com/PervinBuldan/status/1708157246775955636
1707767336206213593,PervinBuldan,"RT @WanHDP: Önceki dönem HDP Eş Genel Başkanımız Pervin Buldan, İl Eş Başkanlarımız, Milletvekillerimiz Bşb.Eş Başkanımız Mustafa avcı,Tuşb…",Fri Sep 29 14:40:36 +0000 2023,0,8,0,https://twitter.com/PervinBuldan/status/1707767336206213593
1707403820286828804,PervinBuldan,Van’da Kadın arkadaşlarımızla göl kenarında güzel bir gün geçirdik. https://t.co/jKPKnqUhmn,Thu Sep 28 14:36:07 +0000 2023,420,12,0,https://twitter.com/PervinBuldan/status/1707403820286828804
1707086122113716588,PervinBuldan,Van’da STK - DKÖ temsilcileriyle buluşmamızı gerçekleştirdik. https://t.co/H3eERpounV,Wed Sep 27 17:33:42 +0000 2023,51,2,0,https://twitter.com/PervinBuldan/status/1707086122113716588
1707021487201251831,PervinBuldan,"RT @WanHDP: Önceki dönem HDP Eş Genel Başkanımız Pervin Buldan Tuşba İlçe esnafını ziyaret etti.

İl Eş Başkanlarmız, milletvekillerimiz Be…",Wed Sep 27 13:16:52 +0000 2023,0,6,0,https://twitter.com/PervinBuldan/status/1707021487201251831
1707017682317434946,PervinBuldan,"Van Tuşba’da Rus Pazarı esnafını ziyaret ettik, sorunlarını dinledik.. https://t.co/2yzTYKzAhl",Wed Sep 27 13:01:44 +0000 2023,177,2,0,https://twitter.com/PervinBuldan/status/1707017682317434946
1701622620360212558,PervinBuldan,https://t.co/h4uhkbK6m5,Tue Sep 12 15:43:41 +0000 2023,293,18,6,https://twitter.com/PervinBuldan/status/1701622620360212558
1701519897048633700,PervinBuldan,Serê gelê Kurd û malbata wî saxbe… #Beytocan https://t.co/hHKTZvvbVY,Tue Sep 12 08:55:30 +0000 2023,1697,47,0,https://twitter.com/PervinBuldan/status/1701519897048633700
1700830979592470801,PervinBuldan,Sevgili Gülçin İsbert’in vefatını üzüntüyle öğrendim. Allahtan rahmet diliyorum. Ailesinin ve sevdiklerinin başı sağolsun. https://t.co/BVq5c53zLv,Sun Sep 10 11:18:00 +0000 2023,447,11,0,https://twitter.com/PervinBuldan/status/1700830979592470801
1698790348015759576,PervinBuldan,Mehmet Sincar ve Metin Özdemir’i katledilişlerinin 30. Yılında sevgi ve saygıyla anıyorum. https://t.co/N4Qw9yBxiv,Mon Sep 04 20:09:15 +0000 2023,457,16,0,https://twitter.com/PervinBuldan/status/1698790348015759576
1698765901686772171,PervinBuldan,Van’da 7 yıl sonra tahliye olan Rasim Sayıner’i evinde ailesiyle ziyaret ettik. Geçmiş olsun.. https://t.co/Yxs99TLCHY,Mon Sep 04 18:32:07 +0000 2023,363,9,0,https://twitter.com/PervinBuldan/status/1698765901686772171
1698715544684269765,PervinBuldan,Van’ın Özalp ilçesinde partimizi ziyaret ettik. https://t.co/9DjJhmzCaT,Mon Sep 04 15:12:01 +0000 2023,152,5,0,https://twitter.com/PervinBuldan/status/1698715544684269765
1698693770198335928,PervinBuldan,Van Saray Kapıköy Sınır Kapısında yaşanan sorunları yerinde inceledik. Halkımızı dinledik.Takipçisi olacağız. https://t.co/Axk4rfwTh2,Mon Sep 04 13:45:29 +0000 2023,104,3,0,https://twitter.com/PervinBuldan/status/1698693770198335928
1697982179265937833,PervinBuldan,Van kedisi değil ama çok şirin.. https://t.co/U0sXikZC0T,Sat Sep 02 14:37:53 +0000 2023,2023,35,0,https://twitter.com/PervinBuldan/status/1697982179265937833
1697976329491112129,PervinBuldan,"RT @dbp_reyaarmuse: Li îro Parlementera @YesillerSol ya Wanê @PervinBuldan, Hevserokê @YesilSolWan @VDilekci û Hevserokê @TuhayVan65 @cetin…",Sat Sep 02 14:14:38 +0000 2023,0,7,0,https://twitter.com/PervinBuldan/status/1697976329491112129
1697962159139926507,PervinBuldan,"RT @WanHDP: Yeniden yapılanma ve inşa sürecinde halkımıza ziyaretlerimiz sürüyor.

HDP önceki dönem  Eş Genel Başkanımız @PervinBuldan , Ye…",Sat Sep 02 13:18:20 +0000 2023,0,7,0,https://twitter.com/PervinBuldan/status/1697962159139926507
1697958968033734760,PervinBuldan,"Van İpekyolu ilçesi, Cumhuriyet Caddesi esnafımızı ziyaret ettik. İlgi ve alakalarından dolayı esnafımıza ve halkımıza teşekkürler. https://t.co/x5y0Ciag7l",Sat Sep 02 13:05:39 +0000 2023,238,2,0,https://twitter.com/PervinBuldan/status/1697958968033734760
1697597659622621208,PervinBuldan,Geçtiğimiz günlerde Barış Annelerinin yaşamını yitirdiği kazada ağır yaralanan Erdal Sefalı’yı Van’da tedavi gördüğü hastanede ziyaret ettik. Bir an önce sağlığına kavuşması için duacıyız. https://t.co/PdNGif2fBz,Fri Sep 01 13:09:56 +0000 2023,134,0,0,https://twitter.com/PervinBuldan/status/1697597659622621208
1697586593450672481,PervinBuldan,Emek ve Demokrasi platformunun Van’da düzenlediği açıklamaya katıldık. https://t.co/YpkhDm79rq,Fri Sep 01 12:25:58 +0000 2023,55,2,0,https://twitter.com/PervinBuldan/status/1697586593450672481
1694024461807235076,PervinBuldan,"Barış Anneleri Perişan Akçelik ve Adalet Safalı’nın Hakkari’de ifade verdikten sonra, Yüksekova’ya dönerken geçirdikleri trafik kazası sonucu yaşamlarını yitirdiklerinin haberini aldık. Aynı kazada ağır yaralanan Cihan Akçelik müdahalelere rağmen kurtarılamadı. Başımız sağolsun.",Tue Aug 22 16:31:19 +0000 2023,283,32,0,https://twitter.com/PervinBuldan/status/1694024461807235076
1694012047896240532,PervinBuldan,"RT @HDPkadin: Barış annesi Perişan Akçelik ve Adile Safali’nin bugün Hakkari’de ifade verdikten sonra, Yüksekova’ya dönerken geçirdikleri t…",Tue Aug 22 15:42:00 +0000 2023,0,20,0,https://twitter.com/PervinBuldan/status/1694012047896240532
1691817263618265583,PervinBuldan,RT @HDPgenelmerkezi: Ablasını kaybeden yoldaşımız Gültan’ın Kışanak cenaze sonrasında yanında ilaçları olmadan Elazığ Cezaevinde depo gibi…,Wed Aug 16 14:20:42 +0000 2023,0,504,0,https://twitter.com/PervinBuldan/status/1691817263618265583
1687797248782905345,PervinBuldan,"RT @HDPgenelmerkezi: Eş Genel Başkanlarımız Buldan ve Sancar, DBP Eş Genel Başkanı Bayındır ve Yeşil Sol Parti milletvekilleri #CumartesiAn…",Sat Aug 05 12:06:36 +0000 2023,0,161,0,https://twitter.com/PervinBuldan/status/1687797248782905345
1687082269125574656,PervinBuldan,Dîyanet ku bawerî û îslamiyetê ji bo berjewendiyên AKP’ê bikar tîne neyartiya lihemberî gelê Kurd didomîn e.Herî dawî bi dilekçeya ku ji doza qumpasê yaKobanî re şandin vê neyartiyê eşkere kirin.Em helwesta Dîyanetê vê futaya ku li ser navê DAIŞ’ê ji dadgehê re şandiye red dikin,Thu Aug 03 12:45:32 +0000 2023,203,25,0,https://twitter.com/PervinBuldan/status/1687082269125574656
1675930356141137921,PervinBuldan,"RT @gulderenvarli: Bugün Eş Genel Başkanımız @PervinBuldan, PM, MYK, il eş başkanlarımız, il STK komisyonu ile  birlikte  @mebyader_w, #tua…",Mon Jul 03 18:11:48 +0000 2023,0,3,0,https://twitter.com/PervinBuldan/status/1675930356141137921
1675923745880285190,PervinBuldan,"RT @WanHDP: HDP Eş genel Başkanımız Pervin Buldan,il Eş Başkanlarımız ve Milletvekillermiz kurum ziyaretlerinden sonra esnaf ve yurttaşları…",Mon Jul 03 17:45:32 +0000 2023,0,10,0,https://twitter.com/PervinBuldan/status/1675923745880285190
1675547789961449477,PervinBuldan,"RT @WanHDP: HDP Eş Genel Başkanımız Pervin Buldan, il Eş Başkanımız Handan Karakoyun ,DBP İl Eş Başkanımız Şengül Polat ve beraberindeki he…",Sun Jul 02 16:51:37 +0000 2023,0,6,0,https://twitter.com/PervinBuldan/status/1675547789961449477
1675547764329947137,PervinBuldan,"RT @WanHDP: HDP Eş Genel Başkanımız Pervin Buldan beraberindeki heyetle Başkale ilçesinde bayramlaşma programına katıldı.

Eş Genel Başkanı…",Sun Jul 02 16:51:31 +0000 2023,0,9,0,https://twitter.com/PervinBuldan/status/1675547764329947137
1675547735032840193,PervinBuldan,"RT @WanHDP: HDP Eş Genel Başkanımız Pervin Buldan Gevaş'ta ilçe yöneticilerimiz ve yurttaşlarla bir araya geldi.

Eş Genel Başkanımız burad…",Sun Jul 02 16:51:24 +0000 2023,0,9,0,https://twitter.com/PervinBuldan/status/1675547735032840193
1675547702422126593,PervinBuldan,"RT @WanHDP: HDP Eş Genel Başkanımız Pervin Buldan, il Eş Başkanımız Handan Karakoyun, TUHAY-DER Eş Başkanı Çetin Uyar ve yöneticilerimizle…",Sun Jul 02 16:51:17 +0000 2023,0,8,0,https://twitter.com/PervinBuldan/status/1675547702422126593
1675547610768109570,PervinBuldan,"RT @WanHDP: HDP Eş Genel Başkanımız Pervin Buldan  Saray ilçesinde bayramlaşma programına katıldı.

Saray ilçemizde halkımızla ve yöneticil…",Sun Jul 02 16:50:55 +0000 2023,0,6,0,https://twitter.com/PervinBuldan/status/1675547610768109570
1675547585413562368,PervinBuldan,"RT @WanHDP: HDP Eş Genel Başkanımız Pervin Buldan'ın  katıldığı bayram ziyaretlerimiz sürüyor.
Özalp ilçe örgütümüzün hazırladığı bayramlaş…",Sun Jul 02 16:50:49 +0000 2023,0,9,0,https://twitter.com/PervinBuldan/status/1675547585413562368
1675547504304087041,PervinBuldan,"RT @WanHDP: HDP Eş Genel Başkanımız Pervin Buldan Erciş, Muradiye ve çaldıran ilçelerimizde ilçe örgütlerimizin bayramlaşma programlarına k…",Sun Jul 02 16:50:29 +0000 2023,0,7,0,https://twitter.com/PervinBuldan/status/1675547504304087041
