ID,Author,Text,Date,Like_Count,Retweet_Count,Reply_Count,URL
1636775088015151105,hdpdemirtas,"Diploman yok.

Yeniden adaylık hakkın yok.

Binlerce insanın ölümünden sorumlusun, utanman yok.

Ülkeyi yoksulluğa boğdun, yatacak yerin yok.

Bu kadar ""yok""ların varken aday olamazsın. https://t.co/H6tzEs1QK2",Fri Mar 17 17:02:45 +0000 2023,59500,6452,10220,https://twitter.com/hdpdemirtas/status/1636775088015151105
1636676323048341504,hdpdemirtas,"Türkiye aç karınla kan ağlıyor. 

Bir yanda deprem ve sel ihmalleri, diğer yanda artan yoksulluk...

AKP yüzyılın felaketidir. https://t.co/rh3JbZBdyB",Fri Mar 17 10:30:18 +0000 2023,23792,3161,1210,https://twitter.com/hdpdemirtas/status/1636676323048341504
1636373218717212672,hdpdemirtas,"Di ser re hezar sal jî derbas bin, birîna me ya nekewiyayî ye Helebce.

Ax Helebce ax... https://t.co/Y7htbJCuFm",Thu Mar 16 14:25:52 +0000 2023,22571,1938,368,https://twitter.com/hdpdemirtas/status/1636373218717212672
1636083400267137024,hdpdemirtas,"Em vê zilmê heq nakin. Werin em bi dil û can bixebitin û ji vê pergala talan û şêlandinê rizgar bibin.

Rehma Xwedê li wan kesên ku di lehiyê de jiyana xwe ji dest dane bibe. Serê nas û xizmên wan û serê gelê me sax be.",Wed Mar 15 19:14:14 +0000 2023,16183,1138,353,https://twitter.com/hdpdemirtas/status/1636083400267137024
1636083359448268801,hdpdemirtas,"Selde yaşamını yitiren kardeşlerime Allah'tan rahmet, tüm halkımıza başsağlığı ve sabır diliyorum.

Bu kadar yıkımı, bu kadar acıyı yaşamayabilirdik. Niteliksiz, beceriksiz talan iktidarının acı faturası ödeniyor.

Bunlardan kurtulmaya az kaldı.",Wed Mar 15 19:14:04 +0000 2023,23348,1851,793,https://twitter.com/hdpdemirtas/status/1636083359448268801
1635666535627857920,hdpdemirtas,"Merhaba arkadaşlar, nasılsınız? 

Bu görselin renkli çıktısını alıp evde buzdolabı kapısına, oda kapılarına yapıştırın lütfen. Ne olduğunu bilmeyen kalmasın, lazım olacak :)

Haydi arkadaşlar, elden ele… 

@YesillerSol https://t.co/NodsoPINnq",Tue Mar 14 15:37:45 +0000 2023,59955,8534,4176,https://twitter.com/hdpdemirtas/status/1635666535627857920
1634241979633774595,hdpdemirtas,"#BizHazırız, herkes hazırsa kalkışa geçiyoruz. Kemerlerinizi bağlayın, değişime doğru yola çıkıyoruz. https://t.co/3ltlUK9yzo",Fri Mar 10 17:17:05 +0000 2023,39483,3239,1801,https://twitter.com/hdpdemirtas/status/1634241979633774595
1633450783344582656,hdpdemirtas,İYİ Parti Genel Başkanı Sayın Meral Akşener'e açık mektubum. https://t.co/Pft295UtnT,Wed Mar 08 12:53:09 +0000 2023,100492,15839,6458,https://twitter.com/hdpdemirtas/status/1633450783344582656
1632837387754647553,hdpdemirtas,Sayın Kılıçdaroğlu'na hayırlı olsun diyoruz. Kendisini HDP'ye de bekliyoruz. https://t.co/UcKkJP5Oi1,Mon Mar 06 20:15:44 +0000 2023,60123,4837,1562,https://twitter.com/hdpdemirtas/status/1632837387754647553
1632794300231589888,hdpdemirtas,"Depremin açtığı yaralar halen kanıyor. Dayanışmayı sürdürelim lütfen. 

Depremzedelerin ihtiyaçları için yapılan kampanyalara katılalım. 

#unutturmayacağız 

Bu akşam 21.00'de mum yakıp pencere kenarına koyarak kaybettiklerimizi analım ve asla unutturmayacağımızı gösterelim.",Mon Mar 06 17:24:31 +0000 2023,27579,2470,763,https://twitter.com/hdpdemirtas/status/1632794300231589888
1632444634143023105,hdpdemirtas,"Sen başını her zamanki gibi dik tut @amedskofficial ve muhteşem futbolunu oyna. 

Beyaz torosçuların siyasi uzantılarını bize bırak.

Bunların ağa(r)babalarına teslim olmadık, artıklarına mı boyun eğeceğiz! https://t.co/MdhYdKgrYS",Sun Mar 05 18:15:04 +0000 2023,68521,8126,2697,https://twitter.com/hdpdemirtas/status/1632444634143023105
1632016537753116673,hdpdemirtas,"Merak etmeyin, liderlerin de sadece bir oyu var, aynen sizin gibi.

Mühür sizin elinizde. Güzel yarınlar sizin elinizde. 

Siz halksınız. İnandığınız yolda yürüyün, liderler sizin arkanızdan gelsin.",Sat Mar 04 13:53:58 +0000 2023,63219,6481,1363,https://twitter.com/hdpdemirtas/status/1632016537753116673
1632016414268637186,hdpdemirtas,"Dünden daha fazla birlik olacağız, daha sıkı sarılacağız birbirimize.

Sen ben yok, BİZ varız ve birlikte başaracağız.",Sat Mar 04 13:53:29 +0000 2023,52743,4418,1290,https://twitter.com/hdpdemirtas/status/1632016414268637186
1632010292736425985,hdpdemirtas,"Bir de HDP'ye kulak verin. Çözüm birlikte, beraberlikte, güçlü demokraside. Hep birlikte kazanacağız.",Sat Mar 04 13:29:09 +0000 2023,14786,1236,268,https://twitter.com/hdpdemirtas/status/1632010292736425985
1630243797924757505,hdpdemirtas,"Ben sana helal olsun (!) diyorum Erdoğan.

100 bin insanın ölümünden sorumlusun ve bırak istifa etmeyi, halen aday olmayı düşünüyorsun.

Hiç utanmıyorsun. Helal olsun be!!!

#helaletmiyorum",Mon Feb 27 16:29:44 +0000 2023,64734,6964,4302,https://twitter.com/hdpdemirtas/status/1630243797924757505
1629477354199302146,hdpdemirtas,"Depremzedelerin acıları da sorunları da bitmedi, ne yazık ki devam ediyor.

Bu nedenle, dayanışmayı her gün büyütmeliyiz. 

Lütfen, imkanlarımızı da zorlayarak halkın yanında olmaya devam edelim. https://t.co/1iYvkZpeZv",Sat Feb 25 13:44:10 +0000 2023,8574,693,183,https://twitter.com/hdpdemirtas/status/1629477354199302146
1628065421667586048,hdpdemirtas,"Yürü Emek ve Özgürlük İttifakı!
Yürü Sosyalist Güç Birliği!
Yürü Millet İttifakı!
Yürü Bay Kemal!

Yan yana yürüyün.

Birleştirin, barıştırın
ve yeniden inşa edelim, yıkılan bu ülkeyi.

Başka çaremiz yok,
başaracağız.

3/3",Tue Feb 21 16:13:39 +0000 2023,82448,11916,3440,https://twitter.com/hdpdemirtas/status/1628065421667586048
1628065277953941506,hdpdemirtas,"Bin tane çözüm önerisi sıralayabiliriz.

Ama şimdi iki temel başlığa odaklanmalıyız.

1- Herkes için acilen konteyner, gıda, temizlik malzemeleri, nitelikli ve yeterli sayıda tuvalet ve duş.

2- Derhal seçime gidip bu çetelerden kurtulmak.

2/3",Tue Feb 21 16:13:04 +0000 2023,21393,2287,312,https://twitter.com/hdpdemirtas/status/1628065277953941506
1628065129651748864,hdpdemirtas,"Halk acı, panik ve çaresizlik içinde.
Kimse yarınlarının ne olacağını bilmiyor. 

İktidar, koltuğunun derdinde.
Muhalefet, halka yardımın haklı telaşında.

1/3",Tue Feb 21 16:12:29 +0000 2023,19213,1646,407,https://twitter.com/hdpdemirtas/status/1628065129651748864
1627396864361349128,hdpdemirtas,"Tüm engellemelere rağmen HDP'li arkadaşlarım, eşbaşkanlarımız, milletvekillerimiz ilk günden beri deprem bölgelerinde aktif görev aldılar. Sıcak koltuklarında oturanlardır, utanması gerekenler. https://t.co/VgS4tpEHdH",Sun Feb 19 19:57:02 +0000 2023,16221,1334,332,https://twitter.com/hdpdemirtas/status/1627396864361349128
1627331763373584389,hdpdemirtas,"Siyaset, acılı insanların yanında inşa edilmezse gerçekçi, kalıcı olamaz.

Ancak acıyı hisseden siyasetçinin sesinde, yüzünde, çözüm önerilerinde hakikati görebiliriz.

Siyaset sadece düşünce değil, daha çok da duygu işidir. Gerisi tüccarlıktır.",Sun Feb 19 15:38:21 +0000 2023,10207,904,194,https://twitter.com/hdpdemirtas/status/1627331763373584389
1627331721539600389,hdpdemirtas,"Kaç parti başkanı, kaç siyasetçi gecelerini çadırlarda yurttaşlarla geçirdi?

Kaçı susuz, tuvaletsiz, banyosuz soğuk 13 gün ve geceyi çocuklarıyla geçiren anne ve babayı tam olarak yüreğinde hissedebildi? 

Umutsuz, çaresiz, yaralı halk için kaçı kan ağlıyor? Gerisi boştur.",Sun Feb 19 15:38:11 +0000 2023,26746,2867,636,https://twitter.com/hdpdemirtas/status/1627331721539600389
1627282140546080773,hdpdemirtas,Dayanışmayı sürdürelim.,Sun Feb 19 12:21:10 +0000 2023,5008,465,65,https://twitter.com/hdpdemirtas/status/1627282140546080773
1626914915482054657,hdpdemirtas,"Yurtsever olun, halkınızı sevin ama pespaye milliyetçiliğe, ırkçılığa bulaşmayın. İnsanlığınızı bile elinizden alır.

3/3",Sat Feb 18 12:01:57 +0000 2023,18944,1621,770,https://twitter.com/hdpdemirtas/status/1626914915482054657
1626914857420222464,hdpdemirtas,"Tam 13 gündür, deprem yıkımını sadece biz hapistekiler  televizyondan izliyoruz, bir de Cumhur'un küçük ortağı izliyor.

Çıktı iki defa konuştu; tehditler, hakaretler savurup indi.

Onun da kurtarmaya çalıştığı ilk şey, Beyefendi'nin koltuğu.

2/3",Sat Feb 18 12:01:43 +0000 2023,16724,1370,279,https://twitter.com/hdpdemirtas/status/1626914857420222464
1626914747105873924,hdpdemirtas,"İktidar, bu korkunç günlerde bile zulümden, baskıdan, adaletsizlikten vazgeçmedi.

""Her yangında ilk kurtarılacak şey, Beyefendi'nin koltuğudur"" diyerek devletin tüm gücünü, koltuğu kurtarmak için seferber ettiler. 

Ancak dördüncü günde sıra depremzedelere gelebildi.

1/3",Sat Feb 18 12:01:16 +0000 2023,10150,1066,158,https://twitter.com/hdpdemirtas/status/1626914747105873924
1626654280957497348,hdpdemirtas,"Sayın Arınç, sizi halen dinliyorsa ona deyin ki, istifa edip siyaseti bıraktığını açıklasın. 

Sandıkta yaşayacağı ağır hezimetten daha iyi bir siyasi son olur, kendisi için.

On binlerce canımız gitti. Yüz binlercemiz yaralı, evsiz...  İSTİFA etmesi için daha ne olmalı!",Fri Feb 17 18:46:17 +0000 2023,21746,2320,686,https://twitter.com/hdpdemirtas/status/1626654280957497348
1626545181590691842,hdpdemirtas,"Depremde yakınlarını kaybeden tutuklu ve hükümlüler, içeride çok zor zamanlar geçiriyorlar.

İzin ve infaz erteleme şeklinde insani bir yaklaşım bekliyorlar. 

27 yıldır içeride olan İlyas Doğan, Adıyaman'da 6 yakınını kaybetmiş mesela.

Lütfen duyarlı olun. @bybekirbozdag",Fri Feb 17 11:32:45 +0000 2023,8262,1005,102,https://twitter.com/hdpdemirtas/status/1626545181590691842
1626494889885065217,hdpdemirtas,"1- Hesap sormak önemli çünkü:

Bunca yıkıma, acıya sebep olanlar bunun bedelini ödemezlerse depremzedeler travmalarını kolay kolay atlatamazlar. https://t.co/oCoorfMEUP",Fri Feb 17 08:12:55 +0000 2023,13573,1806,229,https://twitter.com/hdpdemirtas/status/1626494889885065217
1626493279146582019,hdpdemirtas,"1- Dayanışma çok önemli çünkü:

Milyonlarca kardeşimizin dünyası yıkıldı ve yardımlar olmazsa hayata yeniden tutunmaları çok zor olacak. https://t.co/qkl1ZZ7tqD",Fri Feb 17 08:06:31 +0000 2023,6980,595,52,https://twitter.com/hdpdemirtas/status/1626493279146582019
1626493279146582019,hdpdemirtas,"1- Dayanışma çok önemli çünkü:

Milyonlarca kardeşimizin dünyası yıkıldı ve yardımlar olmazsa hayata yeniden tutunmaları çok zor olacak. https://t.co/qkl1ZZ7tqD",Fri Feb 17 08:06:31 +0000 2023,6980,595,52,https://twitter.com/hdpdemirtas/status/1626493279146582019
1626284620642717699,hdpdemirtas,"RT @hdpdemirtas: İzledikçe kanım dondu, nefesim kesildi. Alçalmanın dibi yok mu!

Bunların bir de onlarca, yüzlerce milyon dolarlık kişisel…",Thu Feb 16 18:17:23 +0000 2023,0,1340,0,https://twitter.com/hdpdemirtas/status/1626284620642717699
1626284607757844480,hdpdemirtas,"RT @hdpdemirtas: Kamu kurumlarının kasasında dururken iyi kötü bir denetime tabi olan 5 milyar dolar, şimdi yardım hesabında ve denetim dış…",Thu Feb 16 18:17:20 +0000 2023,0,1472,0,https://twitter.com/hdpdemirtas/status/1626284607757844480
1626284595904671747,hdpdemirtas,"RT @hdpdemirtas: Üstelik, halkın parasını o cepten alıp bu cebe koyarken bir de vergi indiriminden yararlanıp karlı çıktılar.

Dün akşam, y…",Thu Feb 16 18:17:17 +0000 2023,0,978,0,https://twitter.com/hdpdemirtas/status/1626284595904671747
1626284584705966082,hdpdemirtas,"RT @hdpdemirtas: Madem kamunun elinde ve Erdoğan'ın kontrolünde deprem için rahatlıkla kullanılabilecek bu kadar para vardı, ne diye on bin…",Thu Feb 16 18:17:14 +0000 2023,0,1099,0,https://twitter.com/hdpdemirtas/status/1626284584705966082
1626284572311711746,hdpdemirtas,"RT @hdpdemirtas: Merkez Bankası, Ziraat Bankası, Vakıfbank, Halkbank gibi kurumlardaki halkın parasının ne kadarının kontrolsüz şekilde ken…",Thu Feb 16 18:17:11 +0000 2023,0,900,0,https://twitter.com/hdpdemirtas/status/1626284572311711746
1626284559833657347,hdpdemirtas,"RT @hdpdemirtas: Halkın alın teriyle, emeğiyle oluşan kamu bütçesi tek adam sistemiyle zaten Erdoğan'ın elindeydi.

Dün akşam önemli miktar…",Thu Feb 16 18:17:08 +0000 2023,0,1167,0,https://twitter.com/hdpdemirtas/status/1626284559833657347
1626284546734825480,hdpdemirtas,"RT @hdpdemirtas: Dün akşam, pek çok televizyon kanalında ortak yayın yapıldı ve yardım toplandı.

Stüdyoda emek verenlerin ve kendi cepleri…",Thu Feb 16 18:17:05 +0000 2023,0,3753,0,https://twitter.com/hdpdemirtas/status/1626284546734825480
1626198596046450688,hdpdemirtas,"Dün akşam, pek çok televizyon kanalında ortak yayın yapıldı ve yardım toplandı.

Stüdyoda emek verenlerin ve kendi ceplerinden para gönderenlerin katkıları çok değerli.

Bu yönler hariç, dün geceki ""yardım"" şovu tam bir aldatmacaydı. Büyük bir algı yönetimiydi.

Neden mi?

1/7",Thu Feb 16 12:35:33 +0000 2023,31272,3753,833,https://twitter.com/hdpdemirtas/status/1626198596046450688
1626188924665139200,hdpdemirtas,"Basına ağır cezalar vermeyi tartışan RTÜK üyeleri, AĞIR CEZALAR ifadesini sadece dört ay sonra yargılanırken kendiniz için duymak istemezsiniz.

Kim ister ki? 

Artı TV'den, FOX Haber'den, Halk TV'den, KRT'den, TELE1'den elinizi çekin!",Thu Feb 16 11:57:07 +0000 2023,11932,1166,182,https://twitter.com/hdpdemirtas/status/1626188924665139200
1625894478421626880,hdpdemirtas,"Günü geldiğinde küstahça salladığınız o parmaklarınızı, ortaya koyacağı iradeyle tek tek kırıp saltanatınıza son verecek olan da bu halktır, asıl siz korkun!

Ve iktidarınızın sayılı günlerini efendice tamamlayıp defolun!

Halk ayağa kalkmasını bilir.

4/4 https://t.co/qFZVGAOHBv",Wed Feb 15 16:27:05 +0000 2023,8635,957,289,https://twitter.com/hdpdemirtas/status/1625894478421626880
1625894300604145665,hdpdemirtas,"Siz kendinizi ne sanıyorsunuz be! Devlet sizin tapulu mülkünüz mü? Halk sizin köleniz mi? 

Haddinizi bilin! Mafyavari böğürmelerinizle korkup sinecek bir halk yok karşınızda!

3/4",Wed Feb 15 16:26:23 +0000 2023,21184,1895,868,https://twitter.com/hdpdemirtas/status/1625894300604145665
1625894164616421378,hdpdemirtas,"Trolleri, çeteleri aracılığıyla halkı sindirmeye, korkutmaya, alçakça üste çıkmaya çalışıyorlar. 

Herkes el ele vermiş dayanışmayı büyütmeye çalışırken iki tane eleştiriyi bile kaldıramayan bu aşağılık sürüsü, herkese parmak sallayıp ""Hesap soracağız"" falan diyebiliyor.

2/4",Wed Feb 15 16:25:51 +0000 2023,9977,1029,196,https://twitter.com/hdpdemirtas/status/1625894164616421378
1625894072836661248,hdpdemirtas,"100 binden fazla can kaybı, 85 milyon yaralı yürek var, her yerde feryat var, figan var. Büyük bir yıkım var.

Bu yıkımın sorumluları ise pişkince, utanmazca, pervasızca halen tehditler, hakaretler savuruyor.

1/4",Wed Feb 15 16:25:29 +0000 2023,19037,1803,362,https://twitter.com/hdpdemirtas/status/1625894072836661248
1625811098267009024,hdpdemirtas,"Depremzedeler için kim, nerede, ne yapıyorsa minnettarız, teşekkür ediyoruz.

AHBAP'a, AFAD'a, sağlık emekçilerine, madencilere, belediyelere, sendikalara, odalara, partilere, basın emekçilerine, güvenlik personellerine moral lazım.

Sağ olsunlar, var olsunlar.

1/6",Wed Feb 15 10:55:46 +0000 2023,18162,1275,194,https://twitter.com/hdpdemirtas/status/1625811098267009024
1625563960056418310,hdpdemirtas,"""Bir gece ansızın gelebiliriz"" diye meydan okudukları ne kadar ""düşman"" varsa bir sabah ansızın yardıma geldiler.

Yaralarımızı birlikte sarmayı sürdürürken dostlarımıza dünyanın tüm dillerinde teşekkürler.

Thank you, Spas, Danke, Gracias, Șukran, Efharistó, Շնորհակալություն... https://t.co/QjZiAv4fOL",Tue Feb 14 18:33:44 +0000 2023,24179,2755,723,https://twitter.com/hdpdemirtas/status/1625563960056418310
1625528345906610176,hdpdemirtas,"Kuş yavrularının ve bizim yavrularımızın yuvaları.

Kuşlar sahtekar değil, malzemeden çalmazlar, rüşvet yemezler, oy kaygısı gütmezler.

Biliyor musunuz? Bir zamanlar biz de kuşlar gibiydik, sonra ""uygarlaştık"" ve insan olduk. https://t.co/srg1ro7VjO",Tue Feb 14 16:12:13 +0000 2023,12857,1273,347,https://twitter.com/hdpdemirtas/status/1625528345906610176
1625475251428622337,hdpdemirtas,"Bu felaket önlenebilirdi. Çok yazık. Kibirlerinden, küstahlıklarından kimseyi dinledikleri yok ki!

Bakın değerli Garo, 2018'de nasıl uyarmış. https://t.co/MAKUVQNpem",Tue Feb 14 12:41:14 +0000 2023,16523,2899,334,https://twitter.com/hdpdemirtas/status/1625475251428622337
1625436034610696194,hdpdemirtas,Erdoğan gerçekten haklı mı? https://t.co/YooG4jmbBV https://t.co/qPrVLmGo3H,Tue Feb 14 10:05:24 +0000 2023,3856,416,187,https://twitter.com/hdpdemirtas/status/1625436034610696194
1625167285093650433,hdpdemirtas,"Anayasal suç olmasına rağmen seçimler bir kez ertelenirse bunun önü açılır ve kimse Yüksek Seçim Kuruluna bir daha seçim kararı aldıramaz. 

Deprem felakettir, diktatörlüğe geçiş için ""Allah'ın lütfu"" değildir.

Halk buna izin vermez, nokta.

3/3",Mon Feb 13 16:17:29 +0000 2023,22940,3157,400,https://twitter.com/hdpdemirtas/status/1625167285093650433
1625167181267849217,hdpdemirtas,"Seçimler, Anayasa'nın 78. maddesine göre sadece TBMM'de ve resmen ilan edilmiş savaş hali kararıyla ertelenebilir. Bunun istisnası yoktur.

TBMM'yi yok sayıp seçimleri erteleme kararı almak, açıkça siyasi darbe olur.

2/3",Mon Feb 13 16:17:04 +0000 2023,13323,1915,204,https://twitter.com/hdpdemirtas/status/1625167181267849217
1625167022731542529,hdpdemirtas,"Gelen bilgilere göre, herkes felakete yoğunlaşmışken bir grup hukukçuya, seçimlerin ertelenmesi için çalışma yapılması talimatı verilmiş. 

Bir kez daha, oldu bitti yaparak Anayasa'yı yok saymaya hazırlanıyorlar.

1/3",Mon Feb 13 16:16:27 +0000 2023,19795,2562,434,https://twitter.com/hdpdemirtas/status/1625167022731542529
1625142569565839361,hdpdemirtas,"RT @hdpdemirtas: Ne kadar büyük bir dayanışma ruhu ortaya çıkardığınızı görüyorsunuz. Bunun bozulmasını kabul etmeyin. 

Bu zor günlerin ac…",Mon Feb 13 14:39:16 +0000 2023,0,415,0,https://twitter.com/hdpdemirtas/status/1625142569565839361
1625142556827979776,hdpdemirtas,"RT @hdpdemirtas: Linç ve işkenceye asla prim vermeyelim. Bunlar hem ağır suç hem de çok tehlikeli provokasyonlardır. 

Lütfen dikkatli, sab…",Mon Feb 13 14:39:13 +0000 2023,0,485,0,https://twitter.com/hdpdemirtas/status/1625142556827979776
1625142547432542213,hdpdemirtas,"RT @hdpdemirtas: Yardımları ve dayanışmayı, ihtiyaç listelerini dikkate alarak sürdürelim lütfen. Daha aylarca ihtiyaçlar olacak. 

Depremz…",Mon Feb 13 14:39:11 +0000 2023,0,282,0,https://twitter.com/hdpdemirtas/status/1625142547432542213
1625142538184060929,hdpdemirtas,"RT @hdpdemirtas: Bugün felaketin 8. günü, halen enkazdan insanlarımızın canlı çıkma umudu var. 

Kurtarma çalışmalarına katılan herkese baş…",Mon Feb 13 14:39:09 +0000 2023,0,734,0,https://twitter.com/hdpdemirtas/status/1625142538184060929
1625100798404198400,hdpdemirtas,"Depremzedelerin yaşadıkları zorlukları bir yandan destek ve dayanışmayla diğer yandan da onların hukuki haklarını koruyarak azaltabiliriz.

Doktorlar nasıl gönüllü ekipler oluşturuyorsa avukatlar, mimarlar ve mühendisler de aynısını yapmalı. @TMMOB1954 @barolar

3/3",Mon Feb 13 11:53:17 +0000 2023,7816,846,116,https://twitter.com/hdpdemirtas/status/1625100798404198400
1625099373087453185,hdpdemirtas,"TMMOB ile Baroların,

Enkazlardan numune alınıp delil toplanması,

Enkazdan çıkacak manevi değeri olan her şeyin sahiplerine teslimi, 

Enkazdan çıkacak maddi değeri olan her şeyin sahiplerine teslimi

çalışmalarında aktif yer alması çok iyi olur.

2/3",Mon Feb 13 11:47:38 +0000 2023,5002,564,86,https://twitter.com/hdpdemirtas/status/1625099373087453185
1625098865455005697,hdpdemirtas,"Acılar halen çok taze, çok üzgünüz ama bir yandan da enkaz kaldırma işlemi başladı, maalesef.

Depremzedelerin hukuki, mali ve manevi haklarının korunması için TMMOB ve Baroların karar alıp destek sunması gerekir. 

Deprem enkazı, moloz yığını değildir.

1/3",Mon Feb 13 11:45:37 +0000 2023,6749,733,77,https://twitter.com/hdpdemirtas/status/1625098865455005697
1625034680662740992,hdpdemirtas,"Bugün felaketin 8. günü, halen enkazdan insanlarımızın canlı çıkma umudu var. 

Kurtarma çalışmalarına katılan herkese başarılar diliyorum. Gerçekten de fedakarca, zorluklar içinde kutsal bir iş yapıyorlar.

1/4",Mon Feb 13 07:30:34 +0000 2023,9286,734,98,https://twitter.com/hdpdemirtas/status/1625034680662740992
1624846038778408960,hdpdemirtas,"Evet, Erdoğan seçimle iş başına gelmiş bir devlet memuru ama örneğin bir vergi memuru kadar da iş güvencesi yoktur. 

Mesela isteseniz ilk seçimde kendisini işten çıkarabiliyorsunuz. 

Yani memur olan Erdoğan, patron olan sizsiniz, devlet sizsiniz.

2/2",Sun Feb 12 19:00:58 +0000 2023,20402,2206,597,https://twitter.com/hdpdemirtas/status/1624846038778408960
1624845908926930945,hdpdemirtas,"21 yıl çok uzun bir süre ve o kadar büyük baskılar altında geçti ki, birçok kişi Erdoğan’ı devlet sanıyor.

Halkın bir kısmını, Erdoğan gidince devletin de yıkılıp biteceğine inandırmayı başardılar.

Oysa Erdoğan seçimle iş başına gelmiş bir devlet memuru, hepsi bu.  

1/2",Sun Feb 12 19:00:27 +0000 2023,24036,2578,693,https://twitter.com/hdpdemirtas/status/1624845908926930945
1624808500940443649,hdpdemirtas,"Şehirlerimizi yeniden ve çok sağlam şekilde inşa edeceğiz. Acıların içinden yeni bir yaşamı el ele vererek beraberce kuracağız. 

Yapacak daha çok iş var, yılmak yok, her şeyi dayanışma ile beraber yapacağız. 

Depremzedeleri asla ama asla  yalnız bırakmayacağız.

3/3",Sun Feb 12 16:31:48 +0000 2023,11661,1144,307,https://twitter.com/hdpdemirtas/status/1624808500940443649
1624808246887194624,hdpdemirtas,"İşte tam da böyle zamanlar, Erdoğan'ın gözünü karartıp en çılgın şeyleri yaptığı zamanlardır. 

Ne yaparsa yapsın korkmayın, geri adım atmayın. Ülkenin geri kalanını da yıkmasına izin vermeyin. 

Beraber direnip beraber kazanacağız.

2/3 https://t.co/vWMMsi6LXb",Sun Feb 12 16:30:48 +0000 2023,28846,3106,1940,https://twitter.com/hdpdemirtas/status/1624808246887194624
1624808058558857217,hdpdemirtas,"Otoritesi sarsıldı, makyajı döküldü, fiyakası bozuldu. 

Şimdi acilen ne kadar güçlü, ne kadar kudretli olduğunu göstermeye ihtiyacı var.

1/3 https://t.co/C4xLOuVnPj",Sun Feb 12 16:30:03 +0000 2023,32977,3048,2582,https://twitter.com/hdpdemirtas/status/1624808058558857217
1624760490227367938,hdpdemirtas,"Asıl sorumlular kim?

Eski ve yeni Çevre Şehircilik Bakanları, İçişleri Bakanları, eski başbakanlar, Cumhurbaşkanı.
  
Bunların tamamını soruşturmaya dahil etmeyen savcıların kendileri de suça ortak olurlar.

3/3",Sun Feb 12 13:21:02 +0000 2023,13656,1737,167,https://twitter.com/hdpdemirtas/status/1624760490227367938
1624760394265858049,hdpdemirtas,"Deprem felaketinin deprem katliamına dönüşmesinin asıl sorumluları kim? 

Parti ayırımı olmaksızın eski ve yeni belediye başkanları, imar müdürleri, eski ve yeni çevre şehircilik il müdürleri, yapı denetim firmaları, bakanlık müfettişleri, belediye imar komisyonları.

2/3",Sun Feb 12 13:20:39 +0000 2023,6810,914,56,https://twitter.com/hdpdemirtas/status/1624760394265858049
1624760078992654336,hdpdemirtas,"Müteahhit avı başlatıp ""sorumluyu bulduk, hesap soruyoruz"" demek suçu örtmek, suçluyu saklamak demek.

Hızlıca müteahhitlerin peşine düşmek kolay tabii, peki ya uluorta suçlu olup da görevde olanlar? 

Asıl suçu örtemezsiniz, gerçek suçluları gizleyemezsiniz!

1/3",Sun Feb 12 13:19:24 +0000 2023,12487,1806,150,https://twitter.com/hdpdemirtas/status/1624760078992654336
1624723389486096384,hdpdemirtas,"Felaket bölgelerinde ciddi sağlık sorunları yaşanıyor, salgın tehlikesi var.

Sayın Sağlık Bakanı, daha fazla gecikmeden tabip odaları ile el ele vererek harekete geçin artık.

Durum gerçekten çok kritik. @drfahrettinkoca @ttborgtr",Sun Feb 12 10:53:36 +0000 2023,6757,977,133,https://twitter.com/hdpdemirtas/status/1624723389486096384
1624687020621676544,hdpdemirtas,"Yine de açıkta kalan olursa HDP'nin, depremzedeler ile dayanışmak isteyenleri buluşturacağı kampanyayla, kardeşlerimizin yeni bir ev kurmalarına veya bir eve yerleşmelerine yardımcı olalım. 

Öğrencileri mağdur etmeden depremzedelerin barınma sorunlarını çözmek mümkün.

4/4",Sun Feb 12 08:29:05 +0000 2023,7037,740,116,https://twitter.com/hdpdemirtas/status/1624687020621676544
1624686726881968129,hdpdemirtas,"Depremzedelerin barınma sorununun çözümü, üniversite öğrencilerinin yurtlardan apar topar çıkarılması değildir.

Depremzedeler için,

- Uygun tüm otellerle anlaşma yapılsın.

- Devlet misafirhanelerinin tamamı açılsın. 

- Kira desteği artırılsın.

3/4",Sun Feb 12 08:27:55 +0000 2023,7981,1010,102,https://twitter.com/hdpdemirtas/status/1624686726881968129
1624686627246276609,hdpdemirtas,"Üniversitelere ara verilmesiyle öğrencilerin eğitim hakkı engellenecek.

Güç bela ev tutup kira ödemek zorunda olanlar da mağdur edilecek.

Önemli bir nokta: Deprem bölgesindeki öğrenciler dönem sonuna kadar istedikleri üniversitelere gidebilmeli ve ihtiyaçları karşılanmalı.

2/4",Sun Feb 12 08:27:31 +0000 2023,7364,878,81,https://twitter.com/hdpdemirtas/status/1624686627246276609
