ID,Author,Text,Date,Like_Count,Retweet_Count,Reply_Count,URL
1937503555469873195,umitozdag,"Eşi tarafından öldürülen Fadim Temirhanoğulları’nın bugün Antalya Adliyesi’nde görülen duruşmasına Genel Başkan Yardımcılarımız Suzan Küçüksaraç, Musa Ertugan ve Antalya İl Teşkilatımız ile birlikte katıldık.

Duruşma öncesi adliye önünde basın mensuplarına açıklama yaptım.

""Burada bulunmamızın nedeni yine bir kadın cinayeti ve bu cinayet sonrası görülen dava. Ne yazık ki kadın cinayetleri ne kadar konuşulsa da telin edilse de cinayetlerin sayısında şiddetin sayısında bir azalma olmuyor. Aksine yukarı doğru ciddi bir tırmanmayı yaşıyoruz.
Biz vatan savunması ve nefsi müdafaa dışında şiddeti reddeden bir siyasi duruşu temsil ediyoruz. Kadın cinayetleriyle de etkili bir şekilde mücadele edilmesi gerektiği inancındayız.
Hele bir zamanlar eşi olmuş, çocuklarının annesi olmuş bir kadına yönelik şiddet ve cinayet anlaşılabilir ve izah edilebilir olmaktan çok uzak.
Ben bu dava ile ilgili bilgiyi aileye yakın Zafer Partili arkadaşlarımdan aldım.  Antalya’da bulunduğum için davaya da katılmak istedim. Yine Zafer Partili bir arkadaşım, annesi kaybeden genç kızımın eğitimini yurt dışında üstlenmeyi taahhüt etti ve bunu da kamuoyuyla kendisinin ismini saklı tutarak paylaşmamızı arzu etti. Onu da bu vesileyle sizlerle paylaşmak istiyorum.
Dilerim bu cinayetlerle, kadın cinayetleriyle daha etkili hem psikolojik hem eğitim boyutuyla mücadele edilebilecek günleri yaşadığımız Türkiye’yi oluşturma imkanımız olur.""",Tue Jun 24 13:30:19 +0000 2025,5376,682,39,https://twitter.com/umitozdag/status/1937503555469873195
1937177537983177171,umitozdag,"RT @O_PEHLIVANOGLU: Türk Milletinin Değerli Mensupları,
Bugün Zafer Partililer olarak Balıkesir Burhaniye  Şahinler Köyünde Atadan kalan me…",Mon Jun 23 15:54:50 +0000 2025,0,229,0,https://twitter.com/umitozdag/status/1937177537983177171
1937095744302833677,umitozdag,Parti Sözcümüz Azmi Karamahmutoğlu Zafer Partisi'nin gündeme ilişkin görüşlerini açıklıyor. https://t.co/6bJB1sT3jy,Mon Jun 23 10:29:49 +0000 2025,3066,449,27,https://twitter.com/umitozdag/status/1937095744302833677
1937088715769479188,umitozdag,Tebrik ederim Deniz Başkan. Zafer Partisi çiftçinin yanında @zaferpartisi,Mon Jun 23 10:01:53 +0000 2025,13185,1051,37,https://twitter.com/umitozdag/status/1937088715769479188
1936818213754638341,umitozdag,"Zafer Otağı, düşman ceza hukuku uygulamalarına karşı Zafer Partililerin hukuk devleti adına direnmesinin sembolü olmuştur. Başta İstanbul il başkanlığı ve Silivri ilçe başkanlığı olmak üzere bütün ilçe teşkilatlarımıza, Zafer Otağı fikrinin mimarı değerli kardeşim Ali Dinçer Çolak’a ve emeği geçen bütün Zafer Partililere teşekkür ederim. @zaferpartisi @Alidincercolak",Sun Jun 22 16:07:01 +0000 2025,7830,806,181,https://twitter.com/umitozdag/status/1936818213754638341
1936801883412222246,umitozdag,Avukat Aslıhan Alkan Baz’ın Fatih Altaylı’nın tutuklanması ile ilgili değerlendirmesi hukuk dersi gibi olmuş. Kamu vicdanını rahatsız eden yargı kararları milli birliği değil toplumsal ayrışmayı güçlendirir.@zaferpartisi,Sun Jun 22 15:02:07 +0000 2025,9873,1275,105,https://twitter.com/umitozdag/status/1936801883412222246
1936797309213258157,umitozdag,"RT @BayirFikret: ABD MÜDAHALESİ VE RİSKLER

- ABD İran'ı vurdu ve Trump yaptığı kısa açıklamayı ""Şimdi Barış Zamanı"" diyerek bitirdi. 
-Tru…",Sun Jun 22 14:43:57 +0000 2025,0,455,0,https://twitter.com/umitozdag/status/1936797309213258157
1936751329990394119,umitozdag,Amasya Genelgesi'nin 106. yıl dönümü kutlu olsun! https://t.co/IAi5SmhUc9,Sun Jun 22 11:41:14 +0000 2025,12411,1344,63,https://twitter.com/umitozdag/status/1936751329990394119
1936709869446595048,umitozdag,Sevgili Mustafa Balbay’a değerlendirmesi için teşekkür ediyorum. @zaferpartisi https://t.co/IkzjJpnEk2,Sun Jun 22 08:56:29 +0000 2025,5128,581,50,https://twitter.com/umitozdag/status/1936709869446595048
1936512944977646072,umitozdag,"✅”Önümüzdeki üç gün içinde Orta Doğu'da büyük bir fırtına kopabilir. Bölgedeki tüm ülkelerin diplomasiye yönelmesini umuyoruz.""- Çin Komünist Partisi Askeri İstihbarat Servisi
✅""ABD, birkaç gün içinde İran'a saldırabilir.""- Rusya Askeri İstihbarat Müdürlüğü (GRU)""
✅”Savaş tırmanırsa, İsrail'deki Dimona nükleer reaktörü meşru bir hedef haline gelecek. 
""Daha önce kullanmadığımız daha gelişmiş füzelerimiz var ve bunları kesinlikle kullanacağız.""
El Cezire, üst düzey bir İranlı yetkili”",Sat Jun 21 19:53:59 +0000 2025,13004,1681,157,https://twitter.com/umitozdag/status/1936512944977646072
1936484042284711961,umitozdag,"Nefes Gazetesi Ankara Temsilcisi, değerli gazeteci Deniz Zeyrek'in muhterem babası Zeki Zeyrek'in vefatını üzüntüyle öğrendim.
Merhuma Allah'tan rahmet, Zeyrek ailesine ve sevenlerine başsağlığı diliyorum. https://t.co/7iTV5bHc11",Sat Jun 21 17:59:08 +0000 2025,9927,473,96,https://twitter.com/umitozdag/status/1936484042284711961
1936038190260813872,umitozdag,"Ankara Büyükşehir Belediye Başkanı Sayın Mansur Yavaş'ı ziyaret ederek, tutukluluğum süresince hem bana hem de aileme verdiği moral ve destekten ötürü teşekkür ettim.
Zafer Partisi Başkanlık Divanı Üyelerimiz Prof. Dr. Ali Şehirlioğlu, Suzan Küçüksaraç, Esmaül Hüsna Aslan ve Dr. Fikret Bayır ile yaptığımız ziyarette, Sayın Mansur Yavaş ile ülke gündemine dair fikir alışverişinde bulunduk.",Fri Jun 20 12:27:29 +0000 2025,18074,1346,183,https://twitter.com/umitozdag/status/1936038190260813872
1936016319570215072,umitozdag,Yarın ve Pazar günü gerçekleştirilecek olan YKS sınavına girecek olan tüm kardeşlerime üstün başarılar diliyorum. https://t.co/fulRaDCJst,Fri Jun 20 11:00:34 +0000 2025,22917,560,127,https://twitter.com/umitozdag/status/1936016319570215072
1936001082632610192,umitozdag,"Sevgili öğrenciler, eğitim hayatınızın bir dönemini daha geride bıraktınız.
Ailelerinizle birlikte iyi tatiller diliyorum. https://t.co/9LhIbASL2Y",Fri Jun 20 10:00:01 +0000 2025,5224,369,27,https://twitter.com/umitozdag/status/1936001082632610192
1935987037569483181,umitozdag,"Talat Paşa, Türk tarihinin yakın tarihteki en önemli liderlerinden, devlet adamlarından birisidir.

Türkiye Büyük Millet Meclisi'nin 1926'da aldığı kararla Milli Şehidimizdir. 

Şimdi, Talat Paşa'nın Milli Şehit olduğu kararını alan Türkiye Büyük Millet Meclisi'nin Genel Kurulu'nda bir DEM’li Milletvekili, Talat Paşa'ya hakaret etti. 
Bu kabul edilebilir değildir.

Lozan'ı reddeden Cumhuriyeti, kuruluşunu reddeden, Lozan yerine Sevr Anlaşması’nın gerçekleşmesini arzu eden, Türk tarihinin kahramanlarını katil gibi göstermeye hadsizce kalkan bu zihniyetin Türk milletinin, Türk devletinin, Türkiye Cumhuriyeti'nin dostu olduğunu düşünmek mümkün değildir. 

İçinden geçtiğimiz sözde barış süreci dedikleri süreçte de bunlara güvenilmeyeceğini defaatle söyledik ve uyardık. Şimdi kustukları nefretle her vesileyle tekrar tekrar kendilerine güvenilmeyeceğini Türkiye'ye, tarihimize, kahramanlarımıza düşman olduklarını gösteriyorlar. 

Ben burada sizinle bu konuşmayı yaparken İstanbul'da da Abide-i Hürriyet’te Talat Paşa'nın, Enver Paşa'nın mezarının başında İYİ Parti Genel Başkanı Müsavat Dervişoğlu da benzer bir konuşma yapıyor.

Benim bugün burada olmamı, Sayın Müsavat Dervişoğlu'nun da bugün orada olmasını, dün yapmış olduğumuz toplantı sırasında kararlaştırdık ve bundan sonra da Türk Milleti'ne yönelik, Türk Devleti'ne yönelik her hamlenin karşısında durmaya devam edeceğiz.",Fri Jun 20 09:04:13 +0000 2025,29227,3905,436,https://twitter.com/umitozdag/status/1935987037569483181
1935978758537633861,umitozdag,"Gümülcine eski Başkonsolosu ve Emekli Büyükelçi Kemal Gür'ün vefatını derin üzüntü ile öğrendim.
Kendisine Allah'tan rahmet kederli ailesine ve sevenlerine başsağlığı diliyorum. https://t.co/F8ecioBUWP",Fri Jun 20 08:31:19 +0000 2025,2764,251,22,https://twitter.com/umitozdag/status/1935978758537633861
1935688808386707824,umitozdag,"CHP Edirne Milletvekili Sayın Ahmet Baran Yazgan ve Edirne Belediye Başkanı Sayın Av. Filiz Gencan Akın Zafer Partisi Edirne İl Başkanımız Serkan Konak ile birlikte ziyaretime geldiler.
Kendilerine nazik ziyaretleri ve geçmiş olsun dilekleri için teşekkür ederim. https://t.co/lSjb4pPPJd",Thu Jun 19 13:19:09 +0000 2025,4832,381,57,https://twitter.com/umitozdag/status/1935688808386707824
1935664698382307636,umitozdag,"Cumhuriyet Halk Partisi Genel Genel Başkanı Sayın Özgür Özel'i Zafer Partisi Başkanlık Divanı Üyelerimiz Prof. Dr. Ali Şehirlioğlu, Seyit Yücel ve Suzan Küçüksaraç ile birlikte ziyaret ettik. Manisa Büyükşehir Belediye Başkanı Ferdi Zeyrek'in vefatından dolayı taziyelerimizi ilettim.
Tutukluluğum süresince ziyaretime gelerek, açıklama yaparak destek veren tüm CHP mensuplarına teşekkür ettim.
Sayın Özgür Özel ile Türkiye'nin gündemi ve bölgemizde yaşanan gelişmelerin ülkemize etkileri üzerine görüş alışverişi yaptık.
Nazik ev sahiplikleri için CHP heyetine teşekkür ederim.",Thu Jun 19 11:43:21 +0000 2025,14320,962,158,https://twitter.com/umitozdag/status/1935664698382307636
1935648482020450356,umitozdag,"Zafer Partisi Başkanlık Divanı Üyelerimiz Prof. Dr. Ali Şehirlioğlu, Seyit Yücel ve Suzan Küçüksaraç ile birlikte İYİ Parti Genel Başkanı Müsavat Dervişoğlu'nu ziyaret ettik.
Türkiye ve bölgemizde yaşanan gelişmeler hakkında görüş alışverişinde bulunduk. https://t.co/8rj99B0D2R",Thu Jun 19 10:38:55 +0000 2025,10672,793,167,https://twitter.com/umitozdag/status/1935648482020450356
1935627569786716638,umitozdag,"148 günlük hukuksuz tutukluluğum boyunca hem hukuki hem manevi destekleriyle yanımda olan Türkiye'nin dört bir yanındaki avukatlarlar nezdinde Genel Başkan Yardımcılarımız Prof. Dr. Ali Şehirlioğlu, Seyit Yücel ve Suzan Küçüksaraç ile birlikte Türkiye Barolar Birliği Başkanı Sayın Av. Erinç Sağkan’ı ziyaret ettik.
Destekleri ve nazik ev sahiplikleri için kendilerine teşekkür ederim.
@barolar",Thu Jun 19 09:15:49 +0000 2025,8662,665,76,https://twitter.com/umitozdag/status/1935627569786716638
1935579152742060109,umitozdag,Now TV'de İlker Karagöz ile Çalar Saat programının konuğuyum. https://t.co/MgEoHJ6184,Thu Jun 19 06:03:25 +0000 2025,5034,720,100,https://twitter.com/umitozdag/status/1935579152742060109
1935571992075518162,umitozdag,Saat 09.00’da Now Tv’de gündemi değerlendireceğim @zaferpartisi,Thu Jun 19 05:34:58 +0000 2025,6947,418,135,https://twitter.com/umitozdag/status/1935571992075518162
1935410164376432977,umitozdag,Dominik'i 3-0 mağlup eden #FileninSultanları'nı tebrik ediyorum. https://t.co/6bihlC4YXi,Wed Jun 18 18:51:56 +0000 2025,48757,1227,198,https://twitter.com/umitozdag/status/1935410164376432977
1935381940242137524,umitozdag,Sözcü TV'de İpek Özbey'in sunduğu Özel Röportaj programının konuğuyum. https://t.co/gKh6poMhnW,Wed Jun 18 16:59:46 +0000 2025,7782,1124,176,https://twitter.com/umitozdag/status/1935381940242137524
1935379899910652374,umitozdag,Yarın sabah 09.15'te Now TV'de İlker Karagöz ile Çalar Saat programının konuğu olacağım.,Wed Jun 18 16:51:40 +0000 2025,13378,1013,191,https://twitter.com/umitozdag/status/1935379899910652374
1935361690423505095,umitozdag,"Bu akşam saat 20.00’de Sözcü TV’de İpek Özbey'in sunduğu Özel Röportaj programına konuk olacağım.

@zaferpartisi @ipekkozbey @szctelevizyonu",Wed Jun 18 15:39:18 +0000 2025,5680,578,99,https://twitter.com/umitozdag/status/1935361690423505095
1935298073007366229,umitozdag,"Zafer Partisi Başkanlık Divanı üyeleriyle birlikte, yeniden ve kaldığımız yerden çalışmalarımıza başladık.
Uzun bir aradan sonraki bu ilk divan toplantımız tüm kurullarımıza, teşkilatlarımıza ve Büyük Türk Milleti'ne hayırlı olsun!.. https://t.co/bzRRmVZikV",Wed Jun 18 11:26:31 +0000 2025,22382,1705,397,https://twitter.com/umitozdag/status/1935298073007366229
1935012913686982900,umitozdag,"148 günlük hukuksuzluğun ardından İstanbul'dan Ankara'ya doğru yola çıktık.
Ankara'daki tüm Zafer Partisi mensuplarımız ve kıymetli Ankaralılar ile bu akşam  Zafer Partisi Genel Merkezi'nde buluşacağız!.. https://t.co/cq5w41bjVu",Tue Jun 17 16:33:24 +0000 2025,50350,3009,819,https://twitter.com/umitozdag/status/1935012913686982900
1934986239762899085,umitozdag,"148 gün süren hukuksuzluk bugün sona erdi. 
Ve şimdi kaldığımız yerden mücadelemizin ilk günü!.. https://t.co/0awSEj2EhY",Tue Jun 17 14:47:24 +0000 2025,99464,7828,1830,https://twitter.com/umitozdag/status/1934986239762899085
1934982664819191870,umitozdag,Nerede kalmıştık? 😃,Tue Jun 17 14:33:12 +0000 2025,463757,44384,17162,https://twitter.com/umitozdag/status/1934982664819191870
1934933867279905079,umitozdag,Ümit Özdağ tahliye oluyor! - Canlı Yayın https://t.co/ozBduIVFFI,Tue Jun 17 11:19:17 +0000 2025,60537,7033,2727,https://twitter.com/umitozdag/status/1934933867279905079
1934877053502845402,umitozdag,RT @ozdagaozgurlukp: 1- Zafer Partisi Genel Başkanı Prof. Dr. Ümit ÖZDAĞ’ın tutuklu olarak yargılandığı dosyanın 2. duruşması 10:30’da başl…,Tue Jun 17 07:33:32 +0000 2025,0,345,0,https://twitter.com/umitozdag/status/1934877053502845402
1934715102726640010,umitozdag,"Mera ve zeytinliklere ÇED raporu olmaksızın inşaat yapılabilmesi için bir yasa tasarısı hazırlanmış. İnanılır gibi değil.

Dünya küresel ısınma sonucunda ortaya çıkacak kıtlığa doğru giderken ağaçta yetişen altın olan zeytinin yetiştiği zeytinlikler yok edilebilecek.

Hayvancılık için vazgeçilmez olan, meralar inşaata açılabilecekmiş.

Umarım AK Parti içindeki vicdanlı insanlar buna karşı çıkar ve engeller.

@zaferpartisi @AliSehirlioglu @tvOnlar @ipekkozbey @eceuner12 @saygi_ozturk @fatihaltayli @ferg1923 @ismailsaymaz @cuneytozdemir @OzlemGurses @Deniz_Zeyrek @baharfeyzan @cumhuriyetgzt @gazetesozcu @nefesgazete @KararHaber @nowhaber @halktvcomtr @tele1comtr @szctelevizyonu @KRTCANLI @ankahabera",Mon Jun 16 20:50:00 +0000 2025,15781,2833,179,https://twitter.com/umitozdag/status/1934715102726640010
1934707552551620839,umitozdag,"Yeni Birlik gazetesi yazarı Prof. Dr. Dündar Murat Demiröz çok ilginç, doğru, derinlikli makaleler yazıyor: 16 Haziran 2025'te yayınladığı ""İran’dan sonra sıradaki ülke Türkiye mi?"" başlıklı yazısı çok önemli.

https://t.co/sJzbU6gl2Z",Mon Jun 16 20:20:00 +0000 2025,1951,246,15,https://twitter.com/umitozdag/status/1934707552551620839
1934698744978547167,umitozdag,"17 Haziran saat 10:30’da Silivri Ceza İnfaz Kurumu Kampüsü'ndeki mahkeme salonunda savcının 11 Haziran'da vermiş olduğu mütalaa sonrasında son savunmamı yapacağım. 

148 gün süren uzun bir tutukluluk sonunda Türk Milleti beraat ve tahliye kararını bekliyor.
@zaferpartisi @AliSehirlioglu",Mon Jun 16 19:45:00 +0000 2025,6451,875,121,https://twitter.com/umitozdag/status/1934698744978547167
1934691230157558250,umitozdag,"Anahtar Parti Genel Başkanı Yavuz Ağıralioğlu, Genel Sekreteri Nihal Ağca, Teşkilat Başkanı ve 27. Dönem Milletvekili Av. Ayhan Erel, Medya ve Tanıtım Başkanı Av. Ali Işıner Hamşioğlu, STK İlişkileri Başkanı Hayati Çetin ziyaretime geldiler.

Ülkemiz ve bölgemizle ilgili gelişmeler hakkında istişarelerde bulunma fırsatı elde ettik.

Sayın Yavuz Ağıralioğlu ve heyetine içten teşekkürlerimi sunarım.

@zaferpartisi @AliSehirlioglu @anahtarparti @yavuzagiraliog",Mon Jun 16 19:15:08 +0000 2025,3998,273,80,https://twitter.com/umitozdag/status/1934691230157558250
1934687370114420842,umitozdag,"RT @BartuSoral: TÜRK EKONOMİSİ SAVAŞA HAZIR MI?

İsrail'in İran'a saldıracağını pek çok kişi önceden biliyor, bizim de hedefte olduğumuzu s…",Mon Jun 16 18:59:48 +0000 2025,0,360,0,https://twitter.com/umitozdag/status/1934687370114420842
1934662716590874741,umitozdag,"17 Haziran saat 10.30'da, Silivri Ceza İnfaz Kurumu kampüsünde bulunan duruşma salonunda, 11 Haziran'da, savcının mütalaasını takiben avukatlarımın aldığı ek süre kapsamında savunmamı yapacağım. 

Karar duruşmasında beraat ve tahliyenin gerçekleşmesiyle, Türk Milleti, adalet için yeniden umutlanacak. 
@zaferpartisi @AliSehirlioglu @tvOnlar @ipekkozbey @eceuner12 @saygi_ozturk @fatihaltayli @ferg1923 @ismailsaymaz @cuneytozdemir @OzlemGurses @Deniz_Zeyrek @baharfeyzan @cumhuriyetgzt @gazetesozcu @nefesgazete @KararHaber @nowhaber @halktvcomtr @tele1comtr @szctelevizyonu @KRTCANLI @ankahabera",Mon Jun 16 17:21:50 +0000 2025,7436,952,121,https://twitter.com/umitozdag/status/1934662716590874741
1934652568480948307,umitozdag,"RT @fatiheryilmaz0: TESTİ KIRILMADAN UYARDIK DİNLEMEDİNİZ…

Habertürk’te Çetiner Çetin: ""İran'da, Mosad'a istihbarat sağlayan ajanların %60…",Mon Jun 16 16:41:31 +0000 2025,0,1050,0,https://twitter.com/umitozdag/status/1934652568480948307
1934559463983223101,umitozdag,Yeni Yol Partisi Genel Başkanı Sayın Celal Mümtaz Akıncı'da duruşmaya katılmış. Kendisine teşekkür ediyorum.,Mon Jun 16 10:31:33 +0000 2025,3123,243,18,https://twitter.com/umitozdag/status/1934559463983223101
1934552316952109082,umitozdag,"RT @zaferpartisi: Genel Başkan Yardımcımız Dr. Fikret Bayır, Genel Başkanımız Prof. Dr. Ümit Özdağ’ın yarın Silivri’de görülecek duruşması…",Mon Jun 16 10:03:09 +0000 2025,0,166,0,https://twitter.com/umitozdag/status/1934552316952109082
1934501957986816168,umitozdag,"RT @zaferpartisi: Memleketin derdiyle dertlenen, ülkesinin geleceği için yılmadan mücadele eden Genel Başkanımız Prof. Dr. Ümit Özdağ; bu m…",Mon Jun 16 06:43:02 +0000 2025,0,693,0,https://twitter.com/umitozdag/status/1934501957986816168
1934356801480520102,umitozdag,"Silivri’deki nöbetim süresince değerli avukatlar, barolarımızın kıymetli başkanları, birçok STK temsilcisi ve gazeteci dostlar ziyaretlerini eksik etmediler.

11 Haziran’daki duruşmaya gelen değerli dostlara, vatanseverlere teşekkür ederken, bir kısım değerli ismi yazmamışız. 11 Haziran günü bizimle olan tüm baro başkanları, avukatlar, basın mensupları, STK temsilcilerine tekrar teşekkür ediyorum. 

Yine de isimlerini yazamadıklarımız olabilir, anlayışla karşılamanızı ümit ederken 17 Haziran’daki duruşmaya ilk duruşmaya gelen ve gelemeyen tüm vatanseverleri tekrar davet ediyorum.

DEVA Partisi Ankara Milletvekili Av. İdris Şahin
Aydın Baro Başkanı Av. Utku Devrim Barış Aslan
Çanakkale Baro Başkanı Av. Ardahan Dikme
Denizli Baro Başkanı Av. Ufuk Kök
Edirne Baro Başkanı Av Gökhan Karakoç
Kocaeli Baro Başkanı Av. Caner Karakadılar
Tekirdağ Baro Başkanı Av. Egemen Gürcün
Ümit Özdağ Özgürlük Platformu Avukatları
Meltem TV ve Cumhuriyet Gazetesi'ni temsilen Çağdaş Bayraktar
Birder Genel Başkanı Müjdat Öztürk",Sun Jun 15 21:06:14 +0000 2025,3914,449,41,https://twitter.com/umitozdag/status/1934356801480520102
1934332582830936398,umitozdag,"İsrail'in İran'a yaptığı ve yıkıcı sonuçlar oluşturmaya başlayan saldırıları, Netanyahu'nun İran halkını Humeyni rejimine karşı ayaklanmaya çağırması ile beklenen boyuta doğru ilerliyor.

İsrail, İran'da rejime karşı ayaklanma için çağrı yaparken bu konuda da ciddi hazırlıklar yapmış olduğunu varsaymalıyız. Savaş başlamadan İran içine İHA üstü kuracak kadar sızmayı başaran MOSSAD'ın İran'da rejim muhalifi gruplar ile yoğun temas ötesinde para ve silah başta olmak üzere ciddi temas/hazırlıklar içinde olduğunu kabul edebiliriz.

İsrail'in İran'a saldırılarının uzun süreceği anlaşılıyor. Saldırılar uzadıkça ve rejimin güç dayanakları yıprandıkça muhalif güçler de ayaklanma için daha büyük cesaret ve alan bulacaklardır. Savaş devam ederken İran'ın değişik bölgelerinde rejim karşıtı ayaklanmaların başlaması İran rejimini iyiden iyiye zora sokacaktır. İsrail, sadece İran'da değil Suriye ve Irak'taki ayrılıkçı güçleri de bu ülkelerin parçalanması için tetikleyebilir.

İsrail'i durdurabilecek tek ülke ABD. Trump böyle bir müdahale için İran'ın müzakere masasına baştan teslim olarak dönmesini bekliyor. İsrail'i durdurabilecek ikinci bir gelişme ise Rusya veya Çin'in İran'a savaşın dengelerini değiştirebilecek silah sistemleri vermesi. Bugün için bu da çok zayıf bir ihtimal gibi görünüyor.

@zaferpartisi @AliSehirlioglu @tvOnlar @ipekkozbey @eceuner12 @saygi_ozturk @fatihaltayli @ferg1923 @ismailsaymaz @cuneytozdemir @OzlemGurses @Deniz_Zeyrek @baharfeyzan @cumhuriyetgzt @gazetesozcu @nefesgazete @KararHaber @nowhaber @halktvcomtr @tele1comtr @szctelevizyonu @KRTCANLI @ankahabera",Sun Jun 15 19:30:00 +0000 2025,4114,660,62,https://twitter.com/umitozdag/status/1934332582830936398
1934306084052672688,umitozdag,"17 Haziran’da daha önce hiç duymadıklarınızı duyacak, Kayseri olaylarının arkasındaki gerçekleri öğreneceksiniz. 

17 Haziran 2025 saat 10:30’da Silivri Marmara Cezaevi duruşma salonuna davetlisiniz.

@zaferpartisi @AliSehirlioglu @tvOnlar @ipekkozbey @eceuner12 @saygi_ozturk @fatihaltayli @ferg1923 @ismailsaymaz @cuneytozdemir @OzlemGurses @Deniz_Zeyrek @baharfeyzan @cumhuriyetgzt @gazetesozcu @nefesgazete @KararHaber @nowhaber @halktvcomtr @tele1comtr @szctelevizyonu @KRTCANLI @ankahabera",Sun Jun 15 17:44:42 +0000 2025,9821,1586,66,https://twitter.com/umitozdag/status/1934306084052672688
1934253830994014403,umitozdag,"RT @zaferpartisi: Genel Başkan Vekilimiz Prof. Dr. Ali Şehirlioğlu, yarın (16 Haziran Pazartesi) saat 08.30’da Now TV’de İlker Karagöz’ün k…",Sun Jun 15 14:17:04 +0000 2025,0,191,0,https://twitter.com/umitozdag/status/1934253830994014403
1934174043730579607,umitozdag,"Bu Babalar Günü’nde, evladına uzaktan seslenen her bir babanın hüznünü paylaşıyorum.

Oğlum Alp’i sevgi ve hasretle kucaklıyorum. 

Tüm değerli babaların, Babalar Günü’nü kutluyor, saygı ve selamlarımı yolluyorum. https://t.co/2dTRix9fyA",Sun Jun 15 09:00:01 +0000 2025,18667,1502,290,https://twitter.com/umitozdag/status/1934174043730579607
1934158517272748449,umitozdag,"LGS’ye giren evlatlarımıza başarılar diliyorum. Onları yetiştiren, emek veren kıymetli ailelerini ve öğretmenlerini de saygıyla selamlıyorum.

@zaferpartisi @AliSehirlioglu https://t.co/oOmmU1y0HN",Sun Jun 15 07:58:20 +0000 2025,3245,263,27,https://twitter.com/umitozdag/status/1934158517272748449
1933956870756061595,umitozdag,"Şanlı Türk Jandarma Teşkilatı'nın 186. kuruluş yıl dönümü kutlu olsun! 

#Jandarma186Yaşında https://t.co/ZVOpdqjlgc",Sat Jun 14 18:37:03 +0000 2025,3356,339,31,https://twitter.com/umitozdag/status/1933956870756061595
1933923658889613567,umitozdag,"İsrail'in İran'a saldırıları televizyondan izlendiği kadarı ile bir İsrail-İran savaşından çok İsrail'in İran'da yaptığı bir tatbikata benziyor.

İran, İsrail saldırılarına her anlamda büyük bir hazırlıksızlık içinde yakalanmış durumda. İsrail Hava Kuvvetleri adeta hiç engellenmeden Kum dahil İran kentlerini vuruyor. 

İsrail Hava Kuvvetleri ve SİHA'larının düzenlediği suikast saldırıları gösteriyor ki, Netanyahu isteseydi İran dini lideri ve cumhurbaşkanını da öldürülebilirdi. İsrail'in yıllardan bu yana İran savaşına hazırlandığı anlaşılıyor. Anlaşılmaz olan İran'ın İsrail saldırısına hazırlıksızlığı ve ilk gün sanki bir stratejik felç olma durumunu yaşaması.

Türkiye, İsrail'in İran saldırısını muhakkak inceleyecek ve ciddi askeri dersler çıkaracaktır, çıkarmalıdır da.
@zaferpartisi @AliSehirlioglu @tvOnlar @ipekkozbey @eceuner12 @saygi_ozturk @fatihaltayli @ferg1923 @ismailsaymaz @cuneytozdemir @OzlemGurses @Deniz_Zeyrek @baharfeyzan @cumhuriyetgzt @gazetesozcu @nefesgazete @KararHaber @nowhaber @halktvcomtr @tele1comtr @szctelevizyonu @KRTCANLI @ankahabera",Sat Jun 14 16:25:05 +0000 2025,5615,887,121,https://twitter.com/umitozdag/status/1933923658889613567
1933841851561222219,umitozdag,"İsrail'in Türk kenti Tebriz'i de vurması üzerinde hassasiyetle durulması gereken bir husustur.

Bu Türkiye'ye ""sınırında hassasiyetlerinle oynarım"" mesajıdır.

Geçmiş olsun sevgili Tebriz, geçmiş olsun Sevgili Kızılkurtlar.

@zaferpartisi @alisehirlioglu @FCTractor @tvOnlar @ipekkozbey @eceuner12 @saygi_ozturk @fatihaltayli @ferg1923 @ismailsaymaz @cuneytozdemir @OzlemGurses @Deniz_Zeyrek @baharfeyzan @cumhuriyetgzt @gazetesozcu @nefesgazete @KararHaber @nowhaber @halktvcomtr @tele1comtr @szctelevizyonu @KRTCANLI @ankahabera",Sat Jun 14 11:00:01 +0000 2025,13378,2065,317,https://twitter.com/umitozdag/status/1933841851561222219
